企業名,企業名（英語）,法人番号,代表者_氏名,ホームページ,設立年,設立月,設立年月,資本金_現在,正社員数_現在,売上高_直近,営業利益_直近,株式公開 公開時期,株式公開 上場市場名,主力製品サービス関連技術分野コード,主力製品サービス関連技術分野,主力製品サービス関連技術分野_その他具体,主力製品サービス供給形態コード,サービス供給形態,特許保有_国内,特許保有_海外,特許出願_国内,特許出願_海外,他者ライセンス_大学,他者ライセンス_企業,コア技術特許_文献番号,コア技術特許_出願日,コア技術特許_発明名称,コア技術特許_発明者,事業ステージ_現在コード,事業ステージ,事業ステージ_PoC後到達年,事業ステージ_単年赤字到達年,事業ステージ_単年黒字累積赤字到達年,事業ステージ_単年黒字累積解消到達年,出口戦略,出口戦略.1,1 researchmap,2 researchmap,3 researchmap,4 researchmap,5 researchmap,研究者名,主力製品サービス名_日本語,販売時期_年,販売時期_月,販売年月,販売価格,製品概要　日本語,URL_1,市場性　日本語,競合優位性　日本語,創業者,知人,社員,国内エンジェル,国内VC（事業会社系）,国内VC（大学系）,国内VC（その他）,国内事業会社,国内銀行,国内大学,国内その他,海外エンジェル,海外VC（事業会社系）,海外VC（大学系）,海外VC（その他）,海外事業会社,海外銀行,海外大学,海外その他,資本構成_12調整用その他(国内海外問わず円グラフはこちら入力）,資本構成_リードインベスタ名,調査時点
株式会社ゼネシス,Xenesys Inc.,1010001142153.0,長屋  勝,http://www.xenesys.com,1989.0,3.0,1989年3月," 200,000 ",16.0,,,,,6.0,環境・エネルギー,,1.0,最終財（企業向け製品）,9,1,4,1,,,特許番号第5862133,40795,蒸気動力サイクルシステム,池上 康之、實原 定幸、渡邉 太郎、岡村 盡,,,,,,,8.0,,https://researchmap.jp/,https://researchmap.jp/,https://researchmap.jp/,https://researchmap.jp/,https://researchmap.jp/,"池上 康之　教授,助教　　",・海洋温度差発電 ・全溶接プレート式熱交換器,2013.0,,2013年,規模による,・海洋再生可能エネルギーの一つである海洋温度差発電の計画から設計、建設、運転まで一貫したエンジニアリングサービスの適用 ・海洋温度差発電における主要機器である全溶接スレート式熱交換器の製造、販売,http://www.xenesys.com,海洋温度差発電は、気象条件の影響が小さく、安定した再生可能エネルギーで、量も豊富であり、これからのCO2削減の切り札として期待される発電方式である。,佐賀大学と当社で取り組んできた結果、現在日本の海洋温度差発電技術は世界で最先端と評価されている。特に最重要機器である熱交換器については、当社のみが海洋温度差発電用に開発した特殊なプレート熱交換器を提供可能である。,,5.0,5.0,65.0,,,,24.0,,,,,,,,,1.0,,,,齊藤 栄一,2019年度
株式会社オリゴジェン,"Oligogen, Inc.",1010001169931.0,城戸　常雄,https://oligogen.jp,2015.0,8.0,2015年8月," 98,100,000 ",4.0," 28,000,000 ", 0 ,,,2.0,バイオ・ヘルスケア,,2.0,最終財（一般消費者向け製品）,1,32,0,0,0,0,特願2013－548899,2011/1/12,インビトロでオリゴデンドロサイト系列細胞に分化しやすい哺乳類神経幹細胞および／または神経前駆細胞の純粋または富化集団を入手および維持するための培養方法,城戸　常雄,2.0,製品・サービス提供開始前（PoC後）,,,,,1.0,新規株式公開したい（IPO）,,,,,,,開発中,,,,,主力製品はオリゴデンドロサイトへ非常に高効率（＞９５％）に分化してミエリンを形成する事が出来るヒト神経幹細胞「オリゴジーニー」で、脱髄疾患（先天性大脳白質形成不全症や多発性硬化症など）や脊髄損傷の治療に有用と考えられる。また脱髄がない場合でもオリゴデンドロサイト前駆細胞として働く事のより、アルツハイマー病などの変性疾患治療に有用と考えられる。現在はこれらの疾患に対する臨床治験に向けて準備中である。,,先天性大脳白質形成不全症や脊髄損傷には有効な治療法が存在しないため、市場規模は限定的だが、高いアンメットメディカルニーズが存在する。多発性硬化症は再発を抑える薬はあるが症状を改善する薬はないため、同様に高いアンメットメディカルニーズが存在しており、現在の市場規模は約３兆円と規模も非常に大きい。アルツハイマー病は既存薬の効果が限定的で費用も高いため、オリゴジーニーには高い競争力があると考えられる。,先天性大脳白質形成不全症や脊髄損傷ではまだ有効な治療薬がないが、開発中の競合製品と比べて製造コストが低く、安全性もより高いと考えられる。多発性硬化症に関しても症状を改善する薬はなく、同様に製造コストや安全性で競合優位性を持っている。アルツハイマー病に関しては、昨年承認されたアミロイドベータに対する抗体薬の効果が限定的で費用も高く、少なくとも費用に関して競合優位性を持っていると考えられる。,75.4,4.8,0.0,0.0,13.2,6.5,0.0,0.0,0.0,0.0,0.0,0.0,0.0,0.0,0.0,0.0,0.0,0.0,0.0,,ニッセイキャピタル,2023年度
ＨａｒｖｅｓｔＸ株式会社,HarvestX Inc.,1010001211577.0,市川 友貴,https://harvestx.jp/,2020.0,8.0,2020年8月," 100,000,000 ",10.0, 0 , 0 ,,,4.0,ロボティクス,,1.0,最終財（企業向け製品）,1,0,3,0,0,0,7090953,2021/10/5,農業支援システム、農業支援装置、農業支援方法及び農業支援プログラム,市川友貴、渡邉碧為,,,,,,,1.0,新規株式公開したい（IPO）,,,,,,,開発中,,,,,,,,,57.53,0.0,6.39,0.85,23.8,11.44,0.0,0.0,0.0,0.0,0.0,0.0,0.0,0.0,0.0,0.0,0.0,0.0,0.0,,ANRI4号投資事業有限責任組合,2023年度
セレイドセラピューティクス株式会社,Celaid Therapeutics Inc.,1010001212971.0,荒川信行,https://celaidtx.com/,2020.0,10.0,2020年10月," 560,016,000 ",10.0,,,,,2.0,バイオ・ヘルスケア,,1.0,最終財（企業向け製品）,8,3,8,3,2,0,PCT/JP2021/002252,2020/1/24,ヒト造血幹細胞などの血球系細胞を培養するために適した無血清培地および培養方法,山崎聡、渡部素生,2.0,製品・サービス提供開始前（PoC後）,,,,,2.0,IPOではなく、自社又は事業の一部を他企業等に売却したい（M＆A）,https://researchmap.jp/nashi/?lang=japanese,,,,,山崎聡,開発中,,,,,当社は2020年に設立されたバイオベンチャー企業です。人の血液の源となる造血幹細胞を利用して白血病などの血液がんを含む難治性の血液疾患の治療に役立てる再生医療等製品の研究開発を行っています。血液がん分野の治療では、根治のために一定量の造血幹細胞の移植が必要となります。当社技術で、この造血幹細胞を安全かつ効率的に増やし、新たな再生医療等製品として社会に提供することを目指しています。,https://celaidtx.com/tech/technology/,"当社で開発中の再生医療等製品は造血幹細胞移植に使用する細胞治療製品ですが、造血幹細胞移植の年間実施件数は近年大きく伸長し続けており、世界の市場規模は推定$10B（2030年までに$14Bへ。CAGR4%）となります。
","当社の造血幹細胞増幅技術は他社の技術と比べて、次の３点で優位性があり、差別化要因として活かす製品開発を目指しています。
① 大量増幅しつつ未分化性を維持　⇒　移植後の治療効果が高いことが期待できます
② 遺伝子編集技術を未使用　⇒　安全性の高い細胞治療製品の開発が期待できます
③ 合成化合物で増幅　⇒　品質管理がしやすく、コストを抑えることが期待できます
",,,,,,,,,,,,,,,,,,,,,東京大学エッジキャピタルパートナーズ,2023年度
株式会社クオントディテクト,"Quantdetect, Inc.",1010001217079.0,西塚　哲,https://www.quantdetect.com,2021.0,4.0,2021年4月," 19,920,000 ",2.0,,,,,2.0,バイオ・ヘルスケア,,1.0,最終財（企業向け製品）,1,0,4,2,0,0,特許第6544783号,2018年7月,がんの診療のためのプローブ／プライマーライブラリー,西塚哲　岩谷岳,3.0,製品・サービス提供開始後（単年度赤字）,2021.0,2022.0,2023.0,2024.0,3.0,IPOやM&Aではなく、売上規模や従業員数の拡大を目指したい,,,,,,,がん治療をナビゲートする新しいゲノム検査「OTS-アッセイ」および関連体外診断薬「OTS-Probes」の提供,,,,,"高頻度に検出が予想される遺伝子変異を対象に、血液中のがん由来DNA(circulating tumor DNA, ctDNA)を追跡するためのゲノム検査「OTS-アッセイ」および診断試薬「OTS-Probes」を提供",https://www.quantdetect.com,"「OTS-アッセイ」の対象者は、国内では進行がんの治療患者である100万人。年4回の「OTS-アッセイ」が必要となるため国内だけでも400万回／年の市場がある。現在7か国にPCT国際特許出願中であり、その市場を含めると9,600万回／年市場となる。市場規模としては、国内で1200億円、特許出願中7か国で2.7兆円の市場が見込まれる。",がん診断で現在用いられている一般的な方法はCTスキャンと腫瘍マーカーである。CTスキャンは高額で画像診断であるため病変が小さいと見逃される可能性があり、また被爆可能性があるため頻回検査が困難である。腫瘍マーカーはがん再発以外の要因で数値が容易に変わってしまうため、がんの病変を正確に数値として測定ができない。これら診断に比べ、「OTS-アッセイ」は少額で低侵襲高感度のがん診断が可能である。,94.0,0.0,0.0,0.0,0.0,0.0,6.0,0.0,0.0,0.0,0.0,0.0,0.0,0.0,0.0,0.0,0.0,0.0,0.0,,もりおかSDGs投資事業責任組合（A種優先株主）,2022年度
Ａｍｍｏｎ Ｆｉｅｌｄｓ株式会社,,1010401166652.0,,https://www.ammon-fields.com/,2022.0,4.0,2022年4月,,,,,,,6.0,環境・エネルギー,,3.0,部品・中間財,,,,,,,,,,,,,,,,,,,,,,,,,,,,,,,,,,,,,,,,,,,,,,,,,,,,,,IDATEN Ventures,2023年度
株式会社Ｆｌａｔｔ Ｓｅｃｕｒｉｔｙ,Flatt Security	 Inc.,1011001116543.0,井手 康貴,https://flatt.tech/,2017.0,5.0,2017年5月," 125,620 ",,,,,,9.0,ソフトウェア・アプリ,,4.0,サービス/コンサルティング（受託研究開発を含む）,,,,,,,,,,,3.0,製品・サービス提供開始後（単年度赤字）,,,,,1.0,新規株式公開したい（IPO）,https://researchmap.jp/,https://researchmap.jp/,https://researchmap.jp/,https://researchmap.jp/,https://researchmap.jp/,,●WEB脆弱性診断 https://flatt.tech/assessment/web_application/ Web上のサービスやシステムにセキュリティ上の問題がないか、精鋭のセキュリティエンジニアがツールと手動の両輪でチェックします。問題を報告書としてレポートし、問題点の改修の確認までサポートいたします。 ●その他ITシステムの脆弱性診断 https://flatt.tech スマホアプリ、ネットワーク、クラウド、ゲーム、その他ITシステムにセキュリティ上の問題がないか、精鋭のセキュリティエンジニアがツールと手動の両輪でチェックします。問題を報告書としてレポートし、問題点の改修の確認までサポートいたします。,,,,,●WEB脆弱性診断 Web上のサービスやシステムにセキュリティ上の問題がないか、精鋭のセキュリティエンジニアがツールと手動の両輪でチェックします。問題を報告書としてレポートし、問題点の改修の確認までサポートいたします。 ●その他ITシステムの脆弱性診断 スマホアプリ、ネットワーク、クラウド、ゲーム、その他ITシステムにセキュリティ上の問題がないか、精鋭のセキュリティエンジニアがツールと手動の両輪でチェックします。問題を報告書としてレポートし、問題点の改修の確認までサポートいたします。,https://flatt.tech/assessment/web_application/,,,68.0,,5.0,11.5,,,,15.5,,,,,,,,,,,,,株式会社サイバーエージェント,2019年度
株式会社ＦｉｎｇｅｒＶｉｓｉｏｎ,"FingerVision Co., Ltd",1011301027250.0,濃野 友紀,,2021.0,10.0,2021年10月," 104,000,000 ",0.0,,,,,4.0,ロボティクス,ロボット向け触覚センサー,3.0,部品・中間財,,,,,,,,,,,,,,,,,,,,,,,,山口明彦,,,,,0,,,,0,,,,,,,,,,,,,,,,,,,,慶應イノベーションイニシアティブ,慶應イノベーションイニシアティブ,2021年度
株式会社アレナビオ,"Arenabio Co., Ltd.",1050001016972.0,佐々木　美樹,https://arenabio.com,2005.0,9.0,2005年9月," 10,000,000 ",,,,,,5.0,素材,,4.0,サービス/コンサルティング（受託研究開発を含む）,0,0,0,0,0,0,,,,,3.0,製品・サービス提供開始後（単年度赤字）,,,,,6.0,特に考えていない,,,,,,,乾燥オリーブ葉、乾燥ハーブ、オリーブオイル、介護食、カームミール,,,,,,,,,0.0,0.0,0.0,0.0,100.0,0.0,0.0,0.0,0.0,0.0,0.0,0.0,0.0,0.0,0.0,0.0,0.0,0.0,0.0,,日本戦略投資株式会社,2024年度
株式会社ＨＧプレシジョン,HGP　Co、LTD,1090001014477.0,赤星 直樹,,2016.0,2.0,2016年2月," 9,000 ",3.0,,,,,10.0,その他,弱電,2.0,最終財（一般消費者向け製品）,,,,,,,,,,,,,,,,,1.0,新規株式公開したい（IPO）,,,,,,,,,,,,,,,,,,,,,,,,,,,,,,,,,,,,東北大学ベンチャーパートナーズ,2020年度
株式会社うぃるこ,WILCO Co.， Ltd.,1110001033284.0,山本 麻希,http://www.wilco.company,2018.0,5.0,2018年5月," 3,700,000 ",11.0,"40,568,701 ","-9,740,985 ",,,10.0,その他,鳥獣害,4.0,サービス/コンサルティング（受託研究開発を含む）,0,0,0,0,0,0,,,,,3.0,製品・サービス提供開始後（単年度赤字）,2018.0,2018.0,2022.0,2025.0,,,,,,,,,野生動物による被害対策コンサルティング,2018.0,6.0,2018年6月,,自治体担当者への獣害対策研修、電気柵の維持管理コンサルティング、捕獲請負および指導、集落環境診断およびコンサルティング,https://www.wilco.company/service,主に農水省の交付金、自治体単費、民間企業予算をターゲットにしている。,獣害対策はニーズは高いが、その支援という仕事はまだ市場がなく非常にニッチな業界である。また専門性が高く、基本的に自治体が顧客になるため自治体との関係性構築という参入障壁が高い。,50.0,,12.5,,37.5,,,,,,,,,,,,,,,,SMBCアグリファンド投資事業有限責任組合,2020年度
ゼロワンプロダクツ株式会社,ZEROONE PRODUCTS LTD.,1120001096611.0,樋口伸一,http://www.zeroone-pro.com,1998.0,2.0,1998年2月," 10,000 ",,,,,,5.0,素材,,1.0,最終財（企業向け製品）,1,1,2,2,1,,特許第353648号,6/28/2002,天然木自在シート,樋口伸一、大柳満之,,,2005.0,,,,,,https://researchmap.jp/read0032555,,,,,大柳満之,天然木自在シート及びInsert Molding of Wood,2001.0,6.0,2001年6月,平均値7000円,天然木等板（ツキ板）に高温・高圧で樹脂を含浸させて、柔軟で耐久性の高い自在シートを作る。その自在シートを独自技術でインサート成形する。,https://www.zeroone-pro.com/,従来、天然木を射出成形するのは不可又は大変大きな制約がありましたが、弊社の素材及び独自ノウハウを用いる事で可能になりました。,他社の素材では射出成形する為に大きな制約がありますが弊社の「天然木自材シート/テナージュ」ではその制約がほとんど無くなります。,58.0,,,42.0,,,,,,,,,,,,,,,,,有限会社飛鳥産業,2017年度
株式会社ＡＦＩテクノロジー,AFI Corporation,1120001177428.0,円城寺 隆治,https://www.afi.co.jp/,2013.0,5.0,2013年5月," 99,000,000 ",26.0,,,,マザーズ,2.0,バイオ・ヘルスケア,,1.0,最終財（企業向け製品）,6,2,5,11,0,0,,,,,3.0,製品・サービス提供開始後（単年度赤字）,2016.0,2019.0,2023.0,2027.0,1.0,新規株式公開したい（IPO）,https://researchmap.jp/ read0143558,https://researchmap.jp/ read0013779,https://researchmap.jp/,https://researchmap.jp/,https://researchmap.jp/,"戸井 雅和　教授,紀ノ岡 正博　教授,五十君 静信　教授,内田 諭　教授",微生物汚染リスクモニタリングシステム　エレスタ ピクシーモ,2019.0,9.0,2019年9月,6500000,現在非培養の迅速検査法として、主に蛍光染色法やATP法が利用されている。これらの手法は実際の食品や飲料中の多種多様な成分に対しても反応するためノイズとなる。弊社では電気計測技術及び流体制御技術を活用した革新的フィルタ技術AMATARを独自開発した。このAMATARを利用した製品ELESTA PixeeMoでは、これまでノイズ要素とされてきた多量のサンプル成分中から、微生物を迅速、高感度に検出することができる。,https://www.afi.co.jp/,食品の安全性を高めるための受入原料や工程、最終製品管理の迅速化に対応する製品であり、HACCPの導入義務化により必然性が高まっている。また本技術は臨床微生物検査にも応用可能で、例えば感染症の場合、迅速に細菌を濃縮回収することで細菌同定や薬剤耐性試験などの検査の迅速な実施を可能とする。さらに、本技術は微粒子分離濃縮技術であり、iPS細胞、がん細胞などへの応用も可能で、臨床分野、バイオ分野への応用研究も始めている。,現在非培養の迅速検査法として、主に蛍光染色法やATP法が利用されている。これらの手法は実際の食品や飲料中の多種多様な成分に対しても反応するためノイズとなる。弊社では電気計測技術及び流体制御技術を活用した革新的フィルタ技術AMATARを独自開発した。このAMATARを利用した製品ELESTA PixeeMoでは、これまでノイズ要素とされてきた多量のサンプル成分中から、微生物を迅速、高感度に検出することができる。,,,,,,,,,,,,,,,,,,,,,SCREENホールディングス株式会社,2020年度
株式会社ＴＡＦＤＡＴＡ,TAFDATA.co.ltd.,1120001220575.0,山田将大,https://www.taf-data.co.jp/,2019.0,4.0,2019年4月," 5,010,000 ",1.0,"5,300,000 ","-11,000,000 ",,,7.0,AI・IoT,,1.0,最終財（企業向け製品）,0,0,0,0,0,0,,,,,2.0,製品・サービス提供開始前（PoC後）,2022.0,,,,2.0,IPOではなく、自社又は事業の一部を他企業等に売却したい（M＆A）,,,,,,,AI解析システム,,,,,,,,,90.0,0.0,0.0,0.0,0.0,0.0,10.0,0.0,0.0,0.0,0.0,0.0,0.0,0.0,0.0,0.0,0.0,0.0,0.0,,DEEPCORE,2022年度
株式会社サルース研究所,Salus Research Institute Inc.,1120001243477.0,湯浅　勲,https://salus-lab.com,2022.0,1.0,2022年1月," 9,900,000 ",0.0,,,,,2.0,バイオ・ヘルスケア,,3.0,部品・中間財,7,0,0,0,0,0,6708435,2016/2/26,ケトン体産生促進剤,湯浅　勲、湯浅（小島）　明子,2.0,製品・サービス提供開始前（PoC後）,2024.0,2025.0,2026.0,2028.0,1.0,新規株式公開したい（IPO）,https://researchmap.jp/akiko-k-y,,,,,小島明子、准教授,"開発中
",,,,,アルツハイマー型認知症などの神経変性疾患は脳内でのグルコース利用の抑制によるエネルギー不足により起こる。開発中の製品は脳内でグルコースの代替エネルギーとして利用できるケトン体濃度を亢進させて神経細胞傷害を抑制し、抗認知症効果をもたらすという今までにない新たな機能を有している。顧客としては、食品・サプリメーカー（BtoB）および一般消費者（BtoC）を想定している。,,健康食品・機能性食品の市場は、世界的に拡大傾向にあり、特に日本や欧米、アジア地域で成長が見込まれます。背景には、高齢化の進行、生活習慣病の増加、健康志向の高まりがあり、消費者は予防医療やウェルネスに関心を寄せています。また、科学的根拠に基づく機能性表示食品の増加や、植物由来成分・プロバイオティクス・スーパーフードへの需要拡大も市場を後押ししています。,開発中の製品は脳内でグルコースの代替エネルギーとして利用できるケトン体濃度を亢進させて神経細胞を保護し、抗認知症効果を示す。このような今までにない機能を有しているのが強みです。想定シェアに関しては未定です。,0.0,0.0,0.0,0.0,0.0,0.0,0.0,89.9,0.0,0.0,10.1,0.0,0.0,0.0,0.0,0.0,0.0,0.0,0.0,個人（代表取締役）,なし,2024年度
株式会社ＪＵＭＰＬＩＦＥ,JUMPLIFE,1120901045634.0,黒野寛馬,,2022.0,2.0,2022年2月," 2,000,000 ",1.0,"15,000,000 ","1,000,000 ",,,2.0,バイオ・ヘルスケア,,4.0,サービス/コンサルティング（受託研究開発を含む）,0,0,0,0,0,0,,,,,5.0,製品・サービス提供開始後（単年度黒字かつ累積赤字解消）,,,,,3.0,IPOやM&Aではなく、売上規模や従業員数の拡大を目指したい,,,,,,,"なわとびを活用したレッスン
物販事業",2022.0,2.0,2022年2月,8000,,,,,100.0,0.0,0.0,0.0,0.0,0.0,0.0,0.0,0.0,0.0,0.0,0.0,0.0,0.0,0.0,0.0,0.0,0.0,0.0,,すみません..わかりません。,2024年度
Ｋｖａｓｉｒ　Ｗｏｒｋｓ株式会社,Kvasir Works inc.,1140001129138.0,鶴田一朗,https://kvasirworks.studio.site/,2023.0,2.0,2023年2月,,,,,,,10.0,その他,マーケティング,,,0,0,0,0,0,0,,,,,5.0,製品・サービス提供開始後（単年度黒字かつ累積赤字解消）,,,,,1.0,新規株式公開したい（IPO）,,,,,,,広告代理店サービス、Kvasir Movie Studio、Kvasir Instagram Studio,2023.0,2.0,2023年2月,150000,,,,他サービスは月額で基本料金を取ってサブスクモデルですが、弊社では成果報酬型モデルも導入することでクライアント様と弊社がどちらも良い三方よしのサービスを展開しています。,94.0,0.0,0.0,6.0,0.0,0.0,0.0,0.0,0.0,0.0,0.0,0.0,0.0,0.0,0.0,0.0,0.0,0.0,0.0,,山本敏行,2024年度
４Ｄセンサー株式会社,4D Sensor Inc.,1170001012381.0,森本　吉春,http://4d-sensor.com/,2012.0,2.0,2012年2月," 99,990,000 ",,,,,,10.0,その他,計測機器,,,,,,,,,特許第6590339号,2014年6月,計測方法、計測装置、計測プログラム及び計測プログラムを記録した、コンピュータ読み取り可能な記録媒体,森本吉春，柾谷明大，高木哲史,,,,,,,,,,,,,,,高速／高精度な形状／変形／振動分布計測装置の研究開発,2020.0,2.0,2020年2月,5000000,コア技術：世界最速レベルの3Dスキャナーを開発,http://4d-sensor.com/,弊社が開発したOPPA法は格子模様の位相解析法により，形状／変形／振動分布計測が可能である。画像計測により，試料全面の分布情報が高速／高精度に可視化して求められる。これにより，運動している物体の平面度や振動分布，振動モードなどが簡単に求められ，今までにない高度な情報が得られる。対象物の大小にかかわらず広範囲で高速で計測が可能となり，多くの分野で使用でき，新しい解析法として，広く採用されると考えられる。,弊社が開発した形状／変形／振動分布計測装置は，レーザー変位計／ひずみゲージなどを用いた１点計測法と異なり，格子投影法と画像計測により，試料全面の分布情報が高速／高精度に可視化して求められる。分布を求めるのにスキャンをしていないので，すべての点の情報が同時に得られ，過渡現象の解析も可能である。これにより，インフラ設備の不具合予知や延命化にも使える。他社の製品に比べ，今までにない高性能で，安価である。,49.0,5.0,0.0,0.0,5.0,0.0,30.0,4.0,2.0,0.0,5.0,0.0,0.0,0.0,0.0,0.0,0.0,0.0,0.0,JST,,2022年度
株式会社ＦＡＩ,FAI inc.,1180001160345.0,海老原寛,https://fai-inc.co.jp/,2024.0,2.0,2024年2月," 6,000,000 ",3.0,"1,500,000 ","-7,000,000 ",,,7.0,AI・IoT,,1.0,最終財（企業向け製品）,0,0,0,0,0,0,,,,,1.0,製品・サービス提供開始前（PoC前）,2025.0,2025.0,2030.0,2032.0,1.0,新規株式公開したい（IPO）,,,,,,,シミュレーション技術を駆使した最適設計プラットフォーム,,,,,,https://fai-inc.co.jp/,,,85.7,0.0,0.0,0.0,0.0,0.0,0.0,0.0,0.0,0.0,14.3,0.0,0.0,0.0,0.0,0.0,0.0,0.0,0.0,エンジェル投資家（法人）,富士高周波工業,2024年度
