株式会社フォトニックラティス,"Photonic Lattice, Inc.",4370001012441.0,大沼隼志,https://www.photonic-lattice.com/,2002.0,7.0,2002年7月," 90,000,000 ",37.0," 1,100,000,000 ",,,,1.0,エレクトロニクス,,1.0,最終財（企業向け製品）,,,,,,,,,,,,,,,,,7.0,その他 具体的に,,,,,,,"フォトニック結晶光学素子
光学計測機器（偏光計測装置、偏光ハイスピードカメラ、赤外線ハイスピードカメラ）",2022.0,4.0,2022年4月,,独自の光学技術を用いた光学素子、光学モジュール、検査装置、特注開発、受託サービスを提供しています。,https://www.photonic-lattice.com/cat_products/photonic-crystal-polarizing-optical-components/,,,0.0,0.0,0.0,0.0,0.0,0.0,0.0,100.0,0.0,0.0,0.0,0.0,0.0,0.0,0.0,0.0,0.0,0.0,0.0,,株式会社フォトロン,2023年度
合同会社Ｗｉｓｔｅｒｉａｇｅｎ,"Wisteriagen, LLC",4420003002674.0,藤井　穂高,https://wisteriagen.com,2023.0,3.0,2023年3月," 6,000,000 ",2.0,,,,,2.0,バイオ・ヘルスケア,,4.0,サービス/コンサルティング（受託研究開発を含む）,1,5,0,3,3,0,特許第5954808号（国内）、EP 2963113（欧州）、US 11466306（米国）,2013/2/14,内在性DNA配列特異的結合分子を用いる特定ゲノム領域の単離方法,藤井　穂高、藤田　敏次,3.0,製品・サービス提供開始後（単年度赤字）,,,,2025.0,,,https://researchmap.jp/read0056910,,,,,藤井　穂高・教授,"1. 遺伝子座特異的クロマチン免疫沈降法による創薬標的分子探索サービス
2. Oligoribonucleotide interference (ORNi)-PCRによる遺伝子変異等の検出系",,,,,1. 遺伝子座特異的ChIP法による創薬ターゲット探索：遺伝子発現異常等による難病の治療法の開発のため、病因遺伝子の発現制御領域等を単離し、結合分子の中から好適な創薬標的を見出します。2. ORNi-PCR法による希少な遺伝子配列の検出：変異DNAのような希少配列を検出する際、妨げとなるメジャーな配列の増幅を抑えて、高感度で簡便な検出を実現し、リキッドバイオプシーでの遺伝子変異検出等を行います。,https://wisteriagen.com/science-technologies/chip.html,"1. 遺伝子座特異的ChIP法による創薬標的同定
エピジェネティック創薬ターゲット創出プラットフォームの市場規模は2025年で2,600億円規模と予想される。
2. ORNi-PCRによる遺伝子変異等の検出
ゲノム編集細胞検出プラットフォームの市場希望2025年で2,900億円規模と予想される。
遺伝子変異迅速検出診断プラットフォームの市場希望2025年で4,700億円規模と予想される。","1. 遺伝子座特異的ChIP法による創薬標的同定
操作が簡便である。豊富な実績がある。

2. ORNi-PCRによる遺伝子変異等の検出
超高感度であり、野生型の配列の増幅を阻害するためバックグラウンドが非常に低い。",100.0,0.0,0.0,0.0,0.0,0.0,0.0,0.0,0.0,0.0,0.0,0.0,0.0,0.0,0.0,0.0,0.0,0.0,0.0,,藤井　穂高,2024年度
ＤＭＧ　ＭＯＲＩ　Ｄｉｇｉｔａｌ株式会社,,4430001013788.0,川島  昭彦,www.bug.co.jp,1980.0,10.0,1980年10月," 100,000 ",171.0,"2,668,000,000 ","25,000,000 ",,,9.0,ソフトウェア・アプリ,,1.0,最終財（企業向け製品）,,,,,,,,,,,,,,,,,7.0,特に考えていない,https://researchmap.jp/,https://researchmap.jp/,https://researchmap.jp/,https://researchmap.jp/,https://researchmap.jp/,　　　,工作機械制動ソフトウェア,,,,,,,,,,,,,,,,100.0,,,,,,,,,,,,,DMG森精機株式会社,2019年度
株式会社ＥＶＡセラピューティクス,"EVA Therapeutics, Inc.",5010001175587.0,尾﨑拡,https://evatherapeutics.jp,2021.0,6.0,2021年6月," 5,000,000 ",1.0, 0 ,,,,3.0,医療機器,,2.0,最終財（一般消費者向け製品）,,,,,,,特願2020-084395,2020/5/13,呼吸不全等による低酸素状態の対象を処置することに用いる医薬品組成物,武部貴則他,1.0,製品・サービス提供開始前（PoC前）,2024.0,2028.0,2030.0,2033.0,2.0,IPOではなく、自社又は事業の一部を他企業等に売却したい（M＆A）,,,,,,武部貴則・教授,,,,,,酸素化したパーフルオロデカリンを肛門経由で大腸内に投与する腸呼吸システムの社会実装を目指す大学発ベンチャー。世界的に注目されている若手研究者、武部貴則教授が発見し、ファウンダーとしても直接関与している。市中病院で使用出来ないECMOを代替する、超出生低体重児を救命する等、社会性の高い問題解決に寄与できる技術である。,https://evatherapeutics.jp/,救急搬送現場で発生する年間10万人を超す呼吸器不全患者が主たる対象患者となる。加えて市中病院での重症呼吸不全患者の呼吸管理或いは高度医療施設への搬送等、超未熟児の救命等も当技術の対象疾患となる。日欧米での市場規模は単回型が700億円、ECMO代替の循環型であれば2000億円水準となる見込み。,重症呼吸不全症治療では通常人工呼吸器やECMOが使われるが、高度な医療資源と莫大なコスト（60－100万円/日）が課題で、パンデミック時に市中病院には対応が困難であった。また肺胞障害、出血塞栓、感染症などの有害事象も課題。より簡便に利用できる重症呼吸不全治療用デバイスがあれば、病院・医療従事者の負荷が大幅に低減できる可能性がある。,57.0,4.0,24.0,0.0,0.0,0.0,5.0,10.0,0.0,0.0,0.0,0.0,0.0,0.0,0.0,0.0,0.0,0.0,0.0,,丸石製薬,2023年度
株式会社Ｔｉｍｅｗｉｔｃｈ,Timewitch Inc.,5010701040462.0,三浦健之介,https://timewitch.jp/,2021.0,2.0,2021年2月,,16.0,,,,,7.0,AI・IoT,,1.0,最終財（企業向け製品）,0,0,1,0,0,0,721011855,2023/9/1,テキスト入力に基づいたデザイン分類及び図解を伴ったデザイン生成方法,三浦健之介,5.0,製品・サービス提供開始後（単年度黒字かつ累積赤字解消）,2021.0,2021.0,2022.0,2023.0,,,,,,,,,Alice,2023.0,9.0,2023年9月,2500,入力したテキスト情報を生成AIで読み込んだ上で、裏側に用意してある数千のスライドの雛形に当てはめる形で、5分でスライド作成が完了するサービス,https://ai-alice.com/,"Microsoftを中心に確実に近い将来スライド作成はAI化されると思っており、アメリカの論文によるとその市場規模は1000億円規模になる見込みもある。
その中でもAliceはコンサルタントが作った様なビジネススライドという分野におけるNo.1を目指している。","既存のスライド作成AIは①写真とテキストだけで構成されているデザインスライド②膨大な雛形を人が選択を繰り返して作るサービスの２択。
これに対してTimewitchが提供しているAliceはスライドに落とし込みたい情報を入力するだけでスライドが完成し、さらにポンチ絵が多めのコンサルタントが作った様なデザインの特徴がある。",100.0,0.0,0.0,0.0,0.0,0.0,0.0,0.0,0.0,0.0,0.0,0.0,0.0,0.0,0.0,0.0,0.0,0.0,0.0,,三浦健之介,2023年度
株式会社ｓｕｓｔｅｎキャピタル・マネジメント,Susten Capital Management， inc.,5010901044494.0,岡野 大,https://susten.jp,2019.0,7.0,2019年7月," 405,000,000 ",13.0,0 ,"-8,935,553 ",,,10.0,その他,金融,4.0,サービス/コンサルティング（受託研究開発を含む）,0,0,0,0,0,0,,,,,2.0,製品・サービス提供開始前（PoC後）,2020.0,2021.0,2025.0,2027.0,1.0,新規株式公開したい（IPO）,,,,,,,SUSTEN,2020.0,12.0,2020年12月,,個人投資家及び機関投資家向けの資産運用サービス,https://susten.jp,現在の国内の個人向け資産運用業の市場は、資産規模にして100兆円程度と推算されるところ、年率4-6%程度の市場成長を見込む。,業界初となる完全成果報酬制であること、資産運用効率が既存サービスと比較して優れると想定されること。想定シェアは、5年後において0.3%（受託資産3，000億円）程度。,,,,,,,,,,,,,,,,,,,,,東京理科大学イノベーション・キャピタル,2020年度
株式会社Ｒ－ｂｏｄｙ,R-body Inc.,5011001041671.0,鈴木　岳,https://r-body.com/,2003.0,12.0,2003年12月," 86,000,000 ",36.0,"518,501,013 ","44,462,318 ",,,10.0,その他,ヘルスケア,4.0,サービス/コンサルティング（受託研究開発を含む）,2,0,,,,,特開2022-029324,2020/8/4,情報処理システムおよびプログラム,鈴木　岳,,,,,,,3.0,IPOやM&Aではなく、売上規模や従業員数の拡大を目指したい,,,,,,,"動作不良や首肩腰等の痛みについて、身体の機能改善をはかるアプローチをコンディショニングメソッドで行うサービス。
身体の機能改善をはかることで、生活動作や運動のパフォーマンス向上が促さられます。",2004.0,12.0,2004年12月,33000,身体のコンディショニングを高め機能改善を促すトレーニング施設の運営を行っております。20年間お客様に提供し、成果を積み上げてきた経験をベースにしたコンディショニングコーチの育成事業、コンディショニング施設の受託やトレーナー派遣、コンディショニングサービス導入のコンサル事業を行っております。,https://r-body.com/for_trainers/,自治体との連携モデル（北海道東川町や徳島県美馬市等）での成功事例の展開していく自治体チャネルとの共創事業は、地域の健康課題の解消をはかりたい他の都道府県・市区町村等の自治体への展開は、サービス提供をするコンディショニングコーチ育成事業とセットで拡大していけると考えています。,通常の筋力トレーニングではなく、年齢や体力、運動経験に関係なくできるメニューになっているため、幅広い層の受講ができることや機能解剖学の考え方にそった自身の身体に関する知識や課題を習得していただくサービスであることが特長となります。,58.0,0.0,0.0,0.0,0.0,0.0,0.0,42.0,0.0,0.0,0.0,0.0,0.0,0.0,0.0,0.0,0.0,0.0,0.0,0,鈴木　岳,2024年度
株式会社エルブズ,,5011001109774.0,田中秀樹,,2016.0,2.0,2016年2月," 74,675,000 ",12.0,"76,177,900 ","3,553,804 ",,,9.0,ソフトウェア・アプリ,,4.0,サービス/コンサルティング（受託研究開発を含む）,,,,,,,,,,,4.0,製品・サービス提供開始後（単年度黒字かつ累積赤字）,,,,,1.0,新規株式公開したい（IPO）,,,,,,,AI開発ツール「IXV（イクシブ）」,,,,,開発と運用を革新する、AIによって強化された次世代のAI開発ツールが登場します。IXVなら、複雑なリポジトリを使うことなく、誰でも簡単に利用可能。また常にチームの最新状態を共有、確実な成果物を作成できます。,https://elvez.co.jp/ixv-closed/,,,95.5,0.0,4.4,0.0,0.0,0.0,0.0,0.0,0.0,0.0,0.1,0.0,0.0,0.0,0.0,0.0,0.0,0.0,0.0,自社保有,なし,2024年度
ＡＭＳ企画株式会社,"AMS Planning, Inc.",5011001126563.0,菅原　雄一郎,https://www.ams-plan.com/,2019.0,2.0,2019年2月," 73,990,000 ",6.0,,,,,3.0,医療機器,,1.0,最終財（企業向け製品）,2,0,,,,,,,,,,,,,,,,,,,,,,,開発中,,,,,,,,,,,,,,,,,,,,,,,,,,,,,みらい創造二号投資事業有限責任組合,2024年度
メディカルデータカード株式会社,Medical Data Card Inc.,5011101071602.0,西村  邦裕,https://www.medaca.co.jp,2014.0,10.0,2014年10月," 150,000 ",6.0,,,,,9.0,ソフトウェア・アプリ,,1.0,最終財（企業向け製品）,,,1,,,,,,,,3.0,製品・サービス提供開始後（単年度赤字）,,,,,,,https://researchmap.jp/read0142725,https://researchmap.jp/,https://researchmap.jp/,https://researchmap.jp/,https://researchmap.jp/,洪 繁　准教授　　,患者向けスマホアプリMeDaCa、医療機関向けウェブサービスMeDaCa PRO,2018.0,7.0,2018年7月,患者向けスマホアプリMeDaCaは0円、医療機関向けウェブサービスMeDaCa PROは月額利用料7800円（税抜）にて提供。20床以上の医療機関の場合は、応相談。,患者向けスマホアプリMeDaCa、医療機関向けウェブサービスMeDaCa PROで構成された患者と医師を繋ぐ医療データプラットフォーム。アプリは、血液検査結果・レントゲン写真等の検査データを、自身の健康・医療情報として簡単に管理するデジタルPHR（デジタル・パーソナルヘルスレコード）を実現。また、医療機関はサービスを利用すると患者と医療機関との連携を可能にし、最新の検査データを共有したり、また患者自身のアプリに保管されている過去の医療情報を、患者自身の都度許可の下、閲覧することも可能。またメッセンジャー機能により患者とのコミュニケーションを実現する。,https://www.medaca.co.jp/,国内の医療市場は約43兆円（2018年）で今後も拡大の予想。医療情報を記録・閲覧する電子カルテ市場は2020年には2780億円との予測に加え、医療機関の医療ICT化市場も拡大の予想。その意味で当該サービスの活用は、上記ICT化への費用を大幅に削減。更に医療情報の受渡しにおいて、個人と医療機関の懸け橋としての地位を確保できれば、データベースに大量の医療情報が蓄積され、医療ビッグデータの構築も可能。,当該アプリは、個人が自身の健康・医療情報を管理でき、また個人が情報のコントロールの主役となることを実現するサービスとして誕生した。医療現場では、患者の検査データなどの医療情報は、全て医療機関が管理し、個人にはデジタル情報としてコピーですら管理する手段は存在せず、また最新の検体検査の結果をデジタルで医療機関から患者へ直接送信するサービスは存在していない。また医療機関連携の必要性の認識はあるものの、遅々として進まない状況にあり、この問題も解決する唯一のサービスであると考える。,42.6,40.3,0.8,,,,16.3,,,,,,,,,,,,,,国立研究開発法人科学技術振興機構（JST）,2019年度
株式会社ティムス,TMS Co. Ltd.,5013401006469.0,若林 拓朗,http://www.tms-japan.co.jp/index.html,2005.0,2.0,2005年2月," 99,000 ",10.0,"435,339,200 ","77,527,726 ",,,2.0,バイオ・ヘルスケア,,2.0,最終財（一般消費者向け製品）,,,,,,,,,,,1.0,製品・サービス提供開始前（PoC前）,2020.0,2025.0,2025.0,2026.0,1.0,新規株式公開したい（IPO）,https://researchmap.jp/ 7000025185,,,,,蓮見惠司 教授20208474,,,,,,,,,,,,11.2,17.2,,8.4,54.6,8.6,,,,,,,,,,,,,三菱UFJキャピタル株式会社,2019年度
株式会社Ｅｐｓｉｌｏｎ Ｍｏｌｅｃｕｌａｒ Ｅｎｇｉｎｅｅｒｉｎｇ,Epsilon Molecular Engineering Inc.,5030001116036.0,根本 直人,http://www.epsilon-mol.co.jp/,2016.0,8.0,2016年8月," 21,130 ",5.0,"12,544,000 ",,,,2.0,バイオ・ヘルスケア,,4.0,サービス/コンサルティング（受託研究開発を含む）,,,5,3,3,0,特願2015-072810,3/31/2015,試験管内淘汰及び分子間相互作用解析のための高速光架橋型共用リンカー、そのリンカーを用いた試験管内淘汰方法、親和性測定用リンカー?タンパク質の作製方法及びその方法で作製された親和性測定用リンカー?タンパク質,根本 直人、望月 佑樹,5.0,製品・サービス提供開始後（単年度黒字かつ累積赤字解消）,,,,,1.0,新規株式公開したい（IPO）,https://researchmap.jp/read0147712,https://researchmap.jp/read0170093,https://researchmap.jp/read0080152,https://researchmap.jp/read0118103,https://researchmap.jp/read0084517,"根本 直人,伏見 譲,久保 泰,中井 淳一,藤本 健造",VHH抗体、ペプチドアプタマースクリーニング受託研究サービス,2017.0,6.0,2017年6月,,次世代のバイオ医薬品、中分子医薬品の創出に独自のプラットフォーム技術で取り組んでいます。従来の手法では取得が困難であった標的分子（膜タンパク質等）、さらには既存薬の標的分子においても新たな結合部位に対して高い特異性・親和性を持つVHH抗体やペプチドアプタマーを、1014以上の多様性を持つ高品質ライブラリから弊社独自の高速ハイスル?プットスクリーニングのプラットフォーム技術で単離します。,,当社は創薬支援事業を中心にサービス展開している。世界的にはバイオ医薬品は今後ますます市場が拡大すると予想されている。そのため、当社は国内外を問わず製薬企業に次世代バイオ医薬の候補分子を提供する。次世代バイオ医薬品とは従来の抗体医薬やバイオ医薬では不可能な標的分子（例えば膜タンパク質等）、あるいは一桁以上のコストダウンを引き起こすような革新的医薬品である。,・開発期間の大幅な短縮（６か月を３週間に）、高速スクリーニングシステムの開発。・親和性分子（VHH抗体・アプタマー等）の大幅な向上（従来の１０倍?１００倍）。・分子デザイン力（複合化やAIを含むバイオインフォマティクス）。・膜タンパク質調整技術を含む周辺技術の厚み。・強力な知財戦略。,,,,,,,,,,,,,,,,,,,,,リアルテックファンド,2018年度
株式会社アルガルバイオ,"Algal Bio Co.,Ltd",5040001103751.0,木村　周,https://algalbio.co.jp,2018.0,3.0,2018年3月,,,,,,,2.0,バイオ・ヘルスケア,,4.0,サービス/コンサルティング（受託研究開発を含む）,,,,,,,,,,,,,,,,,,,,,,,,,受託研究・共同研究開発,,,,,東京大学における20年以上の研究で培った多種多様な藻類ライブラリーや、育種技術といった技術基盤に培養ノウハウを掛け合わせることで、社会課題を解決するのに最も適したソリューションを提供する。,https://algalbio.co.jp/movie/,,,,,,,,,,,,,,,,,,,,,,,㈱東京大学エッジキャピタルパートナーズ(UTEC),2022年度
株式会社アグロデザイン・スタジオ,AgroDesign Studios,5050001044210.0,西ヶ谷 有輝,https://www.agrodesign.co.jp/,2018.0,3.0,2018年3月,,,,,,,2.0,バイオ・ヘルスケア,農薬,1.0,最終財（企業向け製品）,,,,,,,,,,,,,,,,,1.0,新規株式公開したい（IPO）,,,,,,,農薬原体（有効成分化合物）の研究・開発,,,,,,https://www.agrodesign.co.jp/,,,,,,,,,,,,,,,,,,,,,,リアルテックファンド,インキュベイトファンド,2021年度
株式会社ヤッペ,Yappe Inc.,5060001026562.0,,www.yappe.co.jp,2014.0,11.0,2014年11月,,,,,,,,,,,,,,,,,,,,,,,,,,,,,,,,,,,,,,,,,,,,,,,,,,,,,,,,,,,,,,,,,長島重夫,2023年度
株式会社三浦ＣＡＤ・ＣＡＭ研究所,Miura CAD/CAM laboratory,5080401022085.0,三浦憲二郎,https://mc2-lab.com,2017.0,4.0,2017年4月," 1,000,000 ",2.0,,,,,9.0,ソフトウェア・アプリ,,4.0,サービス/コンサルティング（受託研究開発を含む）,0,0,0,0,0,0,,,,,3.0,製品・サービス提供開始後（単年度赤字）,2017.0,2023.0,2025.0,2027.0,6.0,特に考えていない,https://researchmap.jp/read0101387,,,,,三浦憲二郎・教授,CAD/CAM/CAEのコンサルテーション,2017.0,5.0,2017年5月,50000,,,,CAD/CAE/CAMに関する長年の研究・開発によるノウハウ,51.0,0.0,49.0,0.0,0.0,0.0,0.0,0.0,0.0,0.0,0.0,0.0,0.0,0.0,0.0,0.0,0.0,0.0,0.0,,代表取締役,2023年度
株式会社ジーンデザイン,"GeneDesign, Inc.",5120901002549.0,片岡 範康,https://www.ajioligos.com,2000.0,12.0,2000年12月," 59,900,000 ",66.0,,,,,2.0,バイオ・ヘルスケア,,3.0,部品・中間財,,,,,,,,,,,,,,,,,,,,,,,,,オリゴ核酸の受託開発製造（医薬用原薬、体外診断薬原料、研究開発用試薬）,,,,,オリゴ核酸の受託開発製造事業者（CDMO）として、研究・開発から上市品までシームレスにサポートいたします。,https://www.ajioligos.com,核酸医薬品の開発品、上市品目の増加により、オリゴ核酸原薬の事業も拡大する。,味の素バイオファーマサービスとして、幅広い開発・製造を支援できます。,,,,,,,,,,,,,,,,,,,,味の素株式会社,,2021年度
ノベリオンシステムズ株式会社,"Novelion Systems Co., Ltd.",5120901022225.0,前野修一,https://www.novelion-sys.com,2006.0,8.0,2006年8月," 6,000,000 ",5.0,"51,855,100 ","556,949 ",,,1.0,エレクトロニクス,,4.0,サービス/コンサルティング（受託研究開発を含む）,2,0,6,3,0,0,,,,,5.0,製品・サービス提供開始後（単年度黒字かつ累積赤字解消）,2006.0,2008.0,2020.0,2021.0,6.0,特に考えていない,,,,,,,"高周波プラズマ源
ECRプラズマ源
イオンビーム源",,,,,,,,,50.0,50.0,0.0,0.0,0.0,0.0,0.0,0.0,0.0,0.0,0.0,0.0,0.0,0.0,0.0,0.0,0.0,0.0,0.0,,前野修一,2024年度
株式会社京都テキストラボ,kyototext lab,5120901042958.0,松尾正信,https://www.kyototextlab.com/,2020.0,7.0,2020年7月," 26,000,000 ",,,,,,7.0,AI・IoT,,4.0,サービス/コンサルティング（受託研究開発を含む）,,,,,,,,,,,,,,,,,,,https://researchmap.jp/m_nomura,https://researchmap.jp/dkw,,,,"野村理朗・准教授,河原大輔・教授",TextAssist,,,,,,,,,,,,,,,,,,,,,,,,,,,,,iCAP,2023年度
株式会社ＴｒｉＯｒｂ,TriOrb.Inc,5290801029287.0,石田秀一,https://triorb.co.jp/,2023.0,2.0,2023年2月," 100,000,000 ",21.0,"53,214,646 ","-246,428,134 ",,,4.0,ロボティクス,,1.0,最終財（企業向け製品）,2,0,0,3,2,0,,,,,3.0,製品・サービス提供開始後（単年度赤字）,2024.0,2024.0,2026.0,2027.0,1.0,新規株式公開したい（IPO）,,,,,,宮本弘之,TriOrb BASE,2023.0,4.0,2023年4月,5000000,高性能な移動プラットフォームとして、多種多様なロボットの駆動部に実装可能なTriOrb BASE。3つの球体と3つのモーターによって、全方向に自由自在に移動できるTriOrb BASEは、既存の全方向移動ロボットでは解決できなかった、段差や溝の走行、mm単位の位置決め、重量物の搬送などの多くの課題を解決します。,https://triorb.co.jp/,"自動化市場を、AGV及びアーム付きAGVの市場で代替し保守的に試算。足元の市場規模約2,000億円、CY22-30期間のCAGR(年平均成長率)約13%を見込む。","ハードウェアは、瞬時に全方向に移動可能、芝や溝の走行が可能、高重量の積載が可能、機体は小型であり多様な荷物の運搬が可能、mm単位での静止が可能。
加えて、ロボットを支えるシステム、ソフトウェア群も ワンストップで提供が可能。",44.0,0.0,19.0,0.0,1.0,23.0,7.0,5.0,0.0,1.0,0.0,0.0,0.0,0.0,0.0,0.0,0.0,0.0,0.0,,東京大学エッジキャピタル,2024年度
株式会社アイカムス・ラボ,"Icomes Lab Co.,Ltd",5400001003543.0,片野圭二,https://www.icomes.co.jp,2003.0,5.0,2003年5月," 42,270,000 ",43.0,"442,170,000 ","-74,410,000 ",,,3.0,医療機器,,1.0,最終財（企業向け製品）,27,5,80,10,0,1,,2009年11月,動力伝達装置,片野圭二　田村孝,5.0,製品・サービス提供開始後（単年度黒字かつ累積赤字解消）,2003.0,2008.0,2015.0,2020.0,3.0,IPOやM&Aではなく、売上規模や従業員数の拡大を目指したい,,,,,,,ペン型電動ピペットpipetty　コードレスディスペンサTofutty,2013.0,10.0,2013年10月,40000,ＰＣＲ、ＥＬＩＳＡの連続分注に最適　高精度な連続分注を実現する世界最小・最軽量のペン型電動ピペット,https://www.icomes.co.jo/product/pipetty,pipettyに無線通信機能を搭載したpipetty-ProはＰＣ専用アプリから実験プロトコルを作成し、分注量を制御することが可能であるほか、海外を含めて自動制御の要望を受けている。,世界最小・最軽量ながらもハンドウォーミングによる精度悪化の改善や連続分注機能を搭載し、高精度な滴下作業をサポートする。,31.0,46.0,19.0,0.0,4.0,0.0,0.0,0.0,0.0,0.0,0.0,0.0,0.0,0.0,0.0,0.0,0.0,0.0,0.0,,岩手新事業創造ファンド１号投資事業有限責任組合,2022年度
