Ｆ．ＭＥＤ株式会社,"F.MED Co.,Ltd.",2290001092337.0,下村景太,https://f-med.co.jp,2021.0,3.0,2021年3月," 308,087,625 ",8.0,,,,,3.0,医療機器,,1.0,最終財（企業向け製品）,,,,,,,,,,,2.0,製品・サービス提供開始前（PoC後）,2024.0,2026.0,2028.0,2029.0,1.0,新規株式公開したい（IPO）,,,,,,江藤正俊、副センター長,マイクロサージャリーと呼ばれる顕微鏡を用いた手術を支援するロボットを開発する。現在は手作業で実施されている極微細な操作をマニピュレータが代替する事で、より安全で有効な手術実施の支援を目指す。同時に、現在は年単位で必要な習得期間を時間単位に削減することで生産性の改善にも貢献することを目指す。,,,,,マイクロサージャリーの実施を支援するロボットを開発する。マイクロサージャリーは顕微鏡を用いた手術で、人の生活の質(QOL)や予後の改善を目的とした手術には欠かせない技術である。しかし、極微細な器具操作を求められるため難易度が高く。実施出来る医師が限られている。この課題に対し、操作者の手振れを制御しつつ縮小化して正確に再現できるマニピュレータを搭載した手術支援ロボットを開発することで解決を目指す。,https://f-med.co.jp,マイクロサージャリーの適応となる患者は世界中に多く存在する。例えば乳房再建の前提となる乳房切除の件数は世界で約100万件/年(OECDデータより)であり、リンパ管静脈吻合(バイパス)術の対象であるリンパ浮腫の患者数は約2.5億人とされている。その一方技術的困難から手術実施数には限りがあるが、ロボット支援により実施数の増加が期待できる。,新たに開発したコア技術の「シリンドリカル・プラットフォーム・マニピュレータ」は従来製品では困難だった、マイクロサージャリーに求められる動作解像度0.01mmを実現できるため、革新的であると考える。,,,,,,,,,,,,,,,,,,,,,Diamond Medino Capital株式会社,2024年度
吸着技術工業株式会社,"Adsorption Technology Industries Co.,Ltd",2310001008744.0,堀田 靖則,http://www.kyuchaku.co.jp/,2006.0,1.0,2006年1月," 10,000,000 ",8.0,,,,,6.0,環境・エネルギー,,1.0,最終財（企業向け製品）,,,,,,,,,,,,,,,,,,,,,,,,,吸着技術を用いたガス発生装置、ガス分離装置、ガス浄化装置などの設計、製造、販売,,,,0,PSAによるガス分離装置を中心に製造販売を行っており、空気から窒素や酸素を発生する装置だけでなく、排ガス等の混合ガスから特定のガスの分離、精製等を行う装置も設計、製造を行っている。,http://www.kyuchaku.co.jp/products/production/,,競合他社と比較して特殊な条件に対しても対応可能。一般的に製品化されていないレベルのガス精製においても基礎試験から検討を行い、実機導入まで対応する事ができる。,,,,,,,,100.0,,,,,,,,,,,,フタムラ化学株式会社,フタムラ化学株式会社,2021年度
株式会社アルファテック,Alphatech.inc,2390001015353.0,駒井 雄一,http://www.alpha-technology.jp/,2018.0,6.0,2018年6月,,,,"-2,000,000 ",,,10.0,その他,畜産・食品,4.0,サービス/コンサルティング（受託研究開発を含む）,,,,,,,,,,,2.0,製品・サービス提供開始前（PoC後）,2021.0,2021.0,2024.0,2025.0,,,https://researchmap.jp/read0072370/?lang=japanese,,,,,西岡昭博,温度制御型粉砕機による、水なしに、スピーディ・低コストに穀類を糊化（アルファ化）させる技術,2021.0,6.0,2021年6月,,,http://www.alpha-technology.jp/atech-tech.html,,,,,,,,,,,,,,,,,,,,,,,ユニバーサルマテリアルズインキュベーター,2020年度
株式会社イノベーションラボ岩手,,2400001015021.0,村上勝俊,https://www.iliwate.co.jp/,2020.0,4.0,2020年4月," 8,000,000 ",,,,,,10.0,その他 具体的に,イノベーション人材の育成,4.0,サービス/コンサルティング（受託研究開発を含む）,0,0,0,0,0,0,,,,,3.0,製品・サービス提供開始後（単年度赤字）,2021.0,2022.0,2024.0,2025.0,6.0,特に考えていない,,,,,,,アントレプレナー人材の育成及び企業・自治体とのマッチングサービス,,,,,学生や若手社会人を対象にアントレプレナーシップを有する人材育成を行い、当該人材が企業や自治体と連携した地域イノベーションへの取組をマネジメントします。,https://www.iliwate.co.jp/project/,イノベションは多様なアイデアが社会に実装されて初めて生じるものです。しかしながら地域では自ら行動を起こす人材が不足しております。そこで、学生や社会人対象のアントレプレナー人材としての育成と当該人材を地域企業や自治体とのマッチングを行い、社会実装に向けた取組を行うことにより、地域イノベーション・エコシステム形成の一端を担うサービスを提供していきます。,当社創業者は「地（知）の拠点大学による地方創生推進事業（COC+）」のコーディネーターとして地域大学や企業、自治体との接点を多く持っております。これらのネットワークの上に会社のサービスがビズネスとして形成されており、他に類を見ない取組となっています。,18.8,7.5,25.0,0.0,0.0,0.0,0.0,37.2,5.0,0.0,6.5,0.0,0.0,0.0,0.0,0.0,0.0,0.0,0.0,協働組合,,2023年度
ＰｌａｔｉｎａＰｌａｓｍｉｄｓ株式会社,"PlatinaPlasmids, Inc.",2420001018360.0,藤井　穂高,https://platinaplasmids.co.jp,2023.0,8.0,2023年8月," 2,000,000 ",,,,,,2.0,バイオ・ヘルスケア,,4.0,サービス/コンサルティング（受託研究開発を含む）,,,,,,,,,,,3.0,製品・サービス提供開始後（単年度赤字）,,,,,,,https://researchmap.jp/read0056910,,,,,藤井　穂高・教授,遺伝子治療等に用いる増幅が困難なプラスミドDNAの提供,,,,,遺伝子治療やmRNAワクチン開発には高品質のDNAが必要です。DNAはプラスミドとして大腸菌内で増幅されることが多いですが、繰り返し配列等のあるプラスミドは、大腸菌内で組換え等のため、正しい配列のプラスミドを増幅することが困難な場合もあります。当社は、独自技術によって、増幅困難なプラスミドも安定的に増幅させることができ、増幅したプラスミドを製薬企業や学術研究機関向けに提供いたします。,https://platinaplasmids.co.jp,"プラスミドDNA製造の全世界の市場規模は2022年に$735.67M（約1,100億円）、2030年予測で$3,733.5M（約5,600億円）と見積もられており、年率22.5%の成長が期待される。
当社のサービスはその中でも増幅困難なプラスミドの提供という比較的ニッチな市場であるが、今後の遺伝子治療やmRNAワクチンの高度化に伴って、無視できない規模のシェアを占めると予想される。","大腸菌内で組換え体等の変異導入が起きない技術を使うため、大腸菌内でのプラスミド増幅の利点である、大量培養が安価に実現できるという特徴を保持している。
試験管内プラスミド増幅法と比較して、新たに複製開始点等を入れる必要はなく、広く使われているプラスミドベクター系をそのまま使うことができるため、手間が少なく、圧倒的な費用の低減と収量の大きさが実現できる。",100.0,0.0,0.0,0.0,0.0,0.0,0.0,0.0,0.0,0.0,0.0,0.0,0.0,0.0,0.0,0.0,0.0,0.0,0.0,,藤井　穂高,2024年度
株式会社テンクー,Xcoo Inc.,3010001139230.0,西村　邦裕,https://xcoo.co.jp/,2011.0,4.0,2011年4月," 100,000,000 ",47.0,,,,,3.0,医療機器,,1.0,最終財（企業向け製品）,5,3,2,9,0,0,特許6737519,2019/3/7,プログラム、学習モデル、情報処理装置、情報処理方法および学習モデルの生成方法,西村邦裕、青木貴司、竹内俊貴、井村純,,,,,,,,,https://researchmap.jp/kuni/,,,,,西村邦裕,"（1）ゲノム医療のためのトータルソリューションソフトウェアサービスChrovis（クロビス）
（2）ゲノム医療のための意思決定支援サービス",,,,,複雑で膨大なデータを整理・解析する高度なデータインテリジェンス技術と、分かりやすく提示するデータ可視化手法を活用し、患者の意思決定を支援します。がんゲノム検査を行う病院などを対象に、個別化医療の推進を目指し、適切に整理・解析されたデータを提供することで、診断・治療の精度向上に貢献し、医師の負担軽減にも役立ちます。,https://chrov.is/,"個別化医療市場は、がん治療や遺伝子解析技術の進展により急速に成長しています。国が骨太の方針にて、全ゲノム解析などゲノム医療を推進しています。新しい遺伝子パネルの承認も予定されており、これに伴い意思決定支援ツールやデータ解析サービスの需要が一層拡大すると思われます。
これらの要因により、精密診断・治療支援の重要性が高まり、医療現場での活用が広がると予測されます。","ゲノム医療の情報解析分野で高い技術と実績を誇り、膨大な選伝子データ解析能力と独自の知識データベースを活用した自動レポート作成サービスなど、医師の解釈の支援、患者さんの理解の支援の総合的なサービスを提供しています。
特に臨床の現場に合わせたサービスが受け入れられています。さらに、遺伝子パスウェイ図やイラストを用いた患者向け説明資料は、国内で唯一のサービスとして高い評価を受けています。",,,,,,,,,,,,,,,,,,,,,スパークス,2024年度
株式会社Ｇｅｌ　Ｃｏａｔ　Ｂｉｏｍａｔｅｒｉａｌｓ,"Gel Coat Biomaterials, Inc.",3010001241564.0,吉田伸,https://www.gelcoatbio.com/,2024.0,1.0,2024年1月," 101,000,208 ",,,,,,2.0,バイオ・ヘルスケア,,1.0,最終財（企業向け製品）,,,,,,,,,,,,,,,,,,,,,,,,,化学合成の効率化、医薬品の開発,,,,,,,,,,,,,,,,,,,,,,,,,,,,,早稲田大学ベンチャーズ,2024年度
株式会社ハイレゾ,"Highreso Co.,ltd",3010401095742.0,志倉喜幸,https://highreso.jp/,2007.0,12.0,2007年12月," 100,000,000 ",44.0,,,,,7.0,AI・IoT,,1.0,最終財（企業向け製品）,0,0,,,0,0,,,,,3.0,製品・サービス提供開始後（単年度赤字）,,,,,,,,,,,,,GPUSOROBAN、PICSOROBAN,,,,,GPUSOROBANは業界最安級のGPUクラウドサービスで、ローカルPCからNVIDIAの高性能GPUインスタンスを利用可能です。画像生成AIやLLM、CAD/BIMなど幅広い作業に対応し、料金は1時間50円から。停止中は課金されず、インスタンスのスペックや台数も柔軟に変更でき、コストを抑えた効率的な運用が可能です。,https://soroban.highreso.jp/,GPUSOROBANは、AI・LLMの需要拡大やメタバース、デジタルツイン市場の成長により、GPUクラウド市場の急成長が期待されます。低コスト・柔軟な料金体系はスタートアップや中小企業に適しており、DX推進や環境配慮の流れも追い風となります。今後、AI開発やIoT分野での利用拡大が進み、2030年までに市場規模は大幅に成長する見込みです。,GPUSOROBANは業界最安級の「1時間50円～」という低価格と、停止中の課金なしでコストを最小化できる点が強みです。NVIDIAの高性能GPUを採用し、AI開発やCAD/BIMなど幅広い用途に対応。クラウドならではの柔軟なスケール調整も可能で、スタートアップから大企業まで多様なニーズに応え、コストパフォーマンスと柔軟性で他社との差別化を実現しています。,,,,,,,,,,,,,,,,,,,,,TUSIC投資事業有限責任組合,2024年度
株式会社Ｌｕｘｏｎｕｓ,Luxonus Inc.,3010401142668.0,相磯貞和,https://www.luxonus.jp/,2018.0,12.0,2018年12月," 99,750,000 ",17.0,,,,,3.0,医療機器,,1.0,最終財（企業向け製品）,,,,,,,,,,,3.0,製品・サービス提供開始後（単年度赤字）,2023.0,2024.0,,,1.0,新規株式公開したい（IPO）,,,,,,,画像検査装置,2023.0,11.0,2023年11月,,画像検査装置,,,,,,,,,,,,,,,,,,,,,,,,慶應イノベーション・イニシアティブ,2024年度
Ｂｌｕｅ Ｐｒａｃｔｉｃｅ株式会社,Blue Practice Co.， Ltd.,3010401143889.0,鈴木 宏治,https://bluepractice.co.jp/,2019.0,2.0,2019年2月," 48,000,000 ",,,,,,3.0,医療機器,,1.0,最終財（企業向け製品）,,,3,3,3,0,,,,,2.0,製品・サービス提供開始前（PoC後）,,,,,1.0,新規株式公開したい（IPO）,,,,,,"教授,教授",次世代型医療用生体モデルシステム,2021.0,1.0,2021年1月,,人の器官や血管の特性を限りなく実物に近づけて人工的に再現する技術と独自のセンサシステムを融合し、医療現場においてはリアリティのある治療シミュレーション、また医療機器開発においては精度を追求した製品テストのプラットフォームを提供いたします。,https://bluepractice.co.jp/products,,Blue Practiceの生体モデルシステムでは、医師の手技感覚（Touch Feeling）を定量的に可視化するため、これまでにない目標値をもった医療トレーニングを実現するとともに、その手技データの付加価値を活かし手術ロボット等の先進医療機器開発に必須となるデータベースの提供企業となり得る。,,,,,,,,,,,,,,,,,,,,,東北大学ベンチャーパートナーズ,2020年度
モーションリブ株式会社,"Motion Lib, Inc.",3020003011147.0,溝口 貴弘,https://www.motionlib.com,2016.0,4.0,2016年4月," 46,000 ",9.0,,,,,1.0,エレクトロニクス,,3.0,部品・中間財,,,,,,,,,,,,,,,,,1.0,新規株式公開したい（IPO）,,https://researchmap.jp/read0081993,,,,大西 公平,Avc Core,2017.0,9.0,2017年9月,,モノの感触や動作をデータ化する「リアルハプディクス技術」を搭載したICチップ「Abc Core」の製造・販売・製品化の共同研究までを行う慶応義塾大学発のベンチャー企業です。「Abc Core」は力センサーや特シャンモーターなどを必要とせず、力加減や力触覚伝送の制御を実現することが出来る点に大きな技術的優位性をもっています。,https://www.motionlib.com/product/abc-core,日本の総人口の減少、労働人口の減少にともない、今後20年でサービスロボットを中心にロボット市場は約4倍になると予測されています。「Abc Core」はサービスロボットに必要な、人やモノに入れ合う技術をロボットや機械にもたせることが出来るようになるため、ロボット市場の拡大とともに拡散される見込みです。,「Abc Core」は力センサーや特殊なモーターを必要とせず、既存のシステムに組み込みやすい汎用性をもっています。繊細な力加減の記録、再現、データ化、編集が出来、力触覚を伝送する制御を簡単に実現する点に技術的優位性をもっています。,,,,,,,,,,,,,,,,,,,,,慶應イノベーション・イニシアティブ,2018年度
合同会社セイフティインテリジェンス,Research Institute for Safety Intelligence,3020003025411.0,三宅淳巳,https://www.safety-intelligence.jp/,2024.0,1.0,2024年1月," 1,000,000 ",1.0,,,,,6.0,環境・エネルギー,,4.0,サービス/コンサルティング（受託研究開発を含む）,0,0,0,0,0,0,,,,,5.0,製品・サービス提供開始後（単年度黒字かつ累積赤字解消）,2024.0,,,2024.0,3.0,IPOやM&Aではなく、売上規模や従業員数の拡大を目指したい,https://researchmap.jp/read0009132,,,,,三宅淳巳,技術支援，技術コンサルティング，人材開発など。,2024.0,1.0,2024年1月,,技術支援，技術コンサルティング，人材開発など。,,大学，研究機関，一般企業など。,代表社員の知見及び実績に基づく技術支援，コンサルティング。,100.0,0.0,0.0,0.0,0.0,0.0,0.0,0.0,0.0,0.0,0.0,0.0,0.0,0.0,0.0,0.0,0.0,0.0,0.0,0,三宅淳巳,2024年度
株式会社Ｏｎｉｋｌｅ,Onikle Inc.,3050001046415.0,立野 温,https://onikle.com/company,2019.0,8.0,2019年8月," 6,000,040 ",2.0,4 ,,,,7.0,AI・IoT,,2.0,最終財（一般消費者向け製品）,,,,,,,,,,,1.0,製品・サービス提供開始前（PoC前）,2021.0,2021.0,2022.0,2024.0,1.0,新規株式公開したい（IPO）,,,,,,,Onikle,2021.0,1.0,2021年1月,1000,,https://onikle.com,研究者向けに、AIによるレコメンド機能を搭載したプレプリントプラットフォームを開発・運用。年間1200時間を必要とする「論文の検索」をハックし、次世代の科学産業のインフラを構築、主導することを目指す。,,,,,,,,,,,,,,,,,,,,,,East Ventures,2020年度
株式会社ＫＵＲＥｉ,ＫＵＲＥｉ Co. Ltd.,3120901037638.0,川本 カワモトヒサトシ,http://kurei.co.jp,2016.0,11.0,2016年11月," 32,825,000 ",4.0,"18,702,000 ","-11,982,000 ",,,2.0,バイオ・ヘルスケア,,1.0,最終財（企業向け製品）,5,0,5,50,6,3,特開2015-038170,8/19/2013,過冷却促進物質,河原秀久,3.0,製品・サービス提供開始後（単年度赤字）,2017.0,2020.0,2021.0,2022.0,1.0,新規株式公開したい（IPO）,https://researchmap.jp/,https://researchmap.jp/,https://researchmap.jp/,https://researchmap.jp/,https://researchmap.jp/,教授,フロストバスター,2020.0,2.0,2020年2月,20000,氷結晶制御技術を過冷却促進物質等の物質により行う。制御物質の研究開発及び製品のデザイン、製造、利用のためのコンサルティングを行う。利用範囲は幅広く農業、食品、化成品、ライフサイエンスなど氷結制御にかかわる分野 ,http//kurei.co.jp,農作物の遅霜による凍霜害防除,現在凍霜害防除で有効な製品がすくない,55.68,,55.92,,25.5,,,18.56,,,,,,,,,,,,,バイオ・サイト・キャピタル株式会社,2020年度
株式会社ａｃｅＲＮＡ Ｔｅｃｈｎｏｌｏｇｉｅｓ,aceRNA Technologies CO.. Ltd.,3130001061959.0,進  照夫,http://acernatec.com/,2018.0,4.0,2018年4月," 23,125 ",4.0,,,,,2.0,バイオ・ヘルスケア,,3.0,部品・中間財,,,,,2,,WO2015/105172,42013,miRNAの発現を指標として所望の細胞種を判別する方法,齊藤 博英,3.0,製品・サービス提供開始後（単年度赤字）,,2019.0,,,1.0,新規株式公開したい（IPO）,https://researchmap.jp/,https://researchmap.jp/,https://researchmap.jp/,https://researchmap.jp/,https://researchmap.jp/,"齊藤 博英　教授,藤田 祥彦　　",RNAスイッチ,2019.0,6.0,2019年6月,,細胞内のmiRNAの状態を認知して細胞を選別するRNAスイッチ試薬販売 RNAスイッチにより、再生医療用途で使用する心筋細胞などを選別し、細胞の純化を行う。,http://acernatec.com/product/,RNAスイッチがターゲットとする再生医療市場です。再生医療の世界市場では2030年に12兆円、2050年には38兆円と予想されており、今後の成長市場として注目されています。当該市場における製品やサービスには、細胞純化の工程が必ず必要であり、当社の技術は、そのニーズを大量に、安く、安全に提供できます。,現状、細胞純化（選別）の工程はセルソーターと呼ばれる機械で行われるのが一般的です。しかし、セルソーターには、細胞へのダメージ、コスト、選別時間など諸問題を抱えています。再生医療を産業として発展させていくためには、大規模なスケールでの対応ができる技術が必要です。当社の技術はこれらの問題を解決することができます。,70.0,,,,,30.0,,,,,,,,,,,,,,,京都大学イノベーションキャピタル株式会社,2019年度
創光科学株式会社,UV Craftory Co. Ltd,3180001058067.0,竹田 浩之,uvcr.jp,2006.0,7.0,2006年7月," 100,000,000 ",3.0,,,,,1.0,エレクトロニクス,,4.0,サービス/コンサルティング（受託研究開発を含む）,23,70,33,107,13,0,①特許第5881222号、②特許第5702898号、③特許第6194138号,42206,①窒化物半導体紫外線発光素子、②紫外線発光装置、③窒化物半導体紫外線発光素子,①ペルノ シリル、平野 光、②山田 貴穂、永井 祥子、古澤 優太、平野 光、本松 正道、青崎 耕、森島 直輝、③金田 倫子、ペルノ シリル、平野 光,,,,,,,2.0,IPOではなく、自社又は事業の一部を他企業等に売却したい（M＆A）,https://researchmap.jp/read014322,,,,,"天野 浩　特別教授,赤﨑 勇　終身教授,",AIGaNによる短波長紫外線LED（350～250nm）,,,,,,,,,30.0,,,,,,,70.0,,,,,,,,,,,,日機装株式会社,日機装株式会社,2021年度
株式会社ＰＲＥＶＥＮＴ,,3180001124224.0,萩原悠太,https://prevent.co.jp/,2016.0,7.0,2016年7月," 100,000,000 ",,,,,,2.0,バイオ・ヘルスケア,,4.0,サービス/コンサルティング（受託研究開発を含む）,0,0,0,0,0,0,,,,,,,,,,,7.0,その他,,,,,,,,,,,,,https://prevent.co.jp/service/,,,0.0,0.0,0.0,0.0,0.0,0.0,0.0,100.0,0.0,0.0,0.0,0.0,0.0,0.0,0.0,0.0,0.0,0.0,0.0,,住友生命保険相互会社,2024年度
株式会社Ｔｒａｎｓｉｔｉｏｎ Ｓｔａｔｅ Ｔｅｃｈｎｏｌｏｇｙ,Transition State Technology Co. Ltd.,3250001004856.0,山口 徹,http://www.tstcl.jp/,2009.0,6.0,2009年6月," 5,550 ",9.0,"104,239,093 ","940,257 ",,,5.0,素材,,4.0,サービス/コンサルティング（受託研究開発を含む）,3,0,4,0,3,0,特許5164111,10/15/2008,化学反応遷移状態探索システムとその方法とそのプログラム,堀　憲次、山口　徹,5.0,製品・サービス提供開始後（単年度黒字かつ累積赤字解消）,2009.0,2010.0,2011.0,2013.0,1.0,新規株式公開したい（IPO）,https://researchmap.jp/read0017099,https://researchmap.jp/m_sumimoto,https://researchmap.jp/,https://researchmap.jp/,https://researchmap.jp/,"堀　憲次・名誉教授,隅本　倫徳",人工知能・理論計算シミュレーションによる受託研究開発 ～機能性分子・触媒開発、反応設計、物性解析～,2009.0,6.0,2009年6月,1260000,人工知能と理論計算（量子化学計算）によるシミュレーションで、機能性分子や材料設計、反応プロセスの開発や改良が可能です。詳細な計算シミュレーションによる理論値は、基礎データとしての活用のほか、既存分析結果との比較・同定、信頼性評価につながります。マテリアルズ・インフォマティクスによる研究開発プロセスの効率化についてもご提案致します。テーマ単位での受託研究開発契約、FTE契約でご利用下さい。,http://www.tstcl.jp/,,,36.0,,11.7,,,,,18.0,,,,,,,,,,,,,創業者,2020年度
ボールウェーブ株式会社,Ball Wave Inc.,3370001038818.0,赤尾慎吾,https://www.ballwave.jp/,2015.0,11.0,2015年11月," 410,104,000 ",11.0,,,,,1.0,エレクトロニクス,,1.0,最終財（企業向け製品）,,,,,,,,,,,3.0,製品・サービス提供開始後（単年度赤字）,,,,,,,,,,,,,超小型ガスクロマトグラフ Sylph,,,,,,https://www.ballwave.jp/products/sylph.php,,,,,,,,,,,,,,,,,,,,,,,東北大学ベンチャーパートナーズ,2024年度
ＳＡＮＳＨＯ株式会社,"SANSHO. Co.,Ltd",4010001114843.0,諸星俊郎,https://c-pa.jp,2008.0,1.0,2008年1月," 59,600,000 ",4.0,"21,760,000 ",-,,,10.0,その他,（新規医薬品の研究開発、原料販売）（化粧品、食品）,4.0,サービス/コンサルティング（受託研究開発を含む）,10,5,69,15,0,0,特許第4162927号,2002/6/11,関節症治療剤,諸星俊郎、室伏きみ子、益田郁子,2.0,製品・サービス提供開始前（PoC後）,2025.0,2029.0,2032.0,2033.0,1.0,新規株式公開したい（IPO）,,,,,,,医薬品の開発に関する製品は未だない。化粧品・食品の原料については環状リゾホスファチジン酸として販売している。（化粧品会社：45社、食品会社2社）,2012.0,1.0,2012年1月,1200000,新規化粧品成分は製造法の特許を保有し、その性質は肌の保湿、ハリをもたらし、且つ配合量を増加すると育毛効果を発揮する。世界で初めての化学構造成分。,,新規成分で、効果も明確に示す多くのエビデンスを得ているので、マーケット戦略と宣伝が整えば、世界各国で販売可能と考えられる。,育毛作用を発揮する商品は数多く市場に出回っているが、現実的に効果として有効性が証明されているのはほとんどない。本物質（環状リゾホスファチジン酸）は科学的データも多く、既に配合されて商品となっている育毛商品で多くの実績がある。,11.2,0.0,40.0,10.6,11.2,0.0,27.0,0.0,0.0,0.0,0.0,0.0,0.0,0.0,0.0,0.0,0.0,0.0,0.0,,台湾オリエント・ユーロファルマ社（製薬企業）,2024年度
