東京大学エコノミックコンサルティング株式会社,UTokyo Economic Consulting Inc.,8010001211397.0,川原田陽介,https://utecon.net,2020.0,8.0,2020年8月," 100,000,000 ",,,,,,10.0,その他,経済学を活用したコンサルティング,4.0,サービス/コンサルティング（受託研究開発を含む）,,,,,,,,,,,5.0,製品・サービス提供開始後（単年度黒字かつ累積赤字解消）,2020.0,2020.0,2021.0,2021.0,3.0,IPOやM&Aではなく、売上規模や従業員数の拡大を目指したい,,,,,,,経済学を活用したコンサルティング,2020.0,8.0,2020年8月,,クライアント特有の問題にオーダーメイドで解決方法を提案し、経済学等の専門知識を有した東京大学の教員やその他UTEconのエキスパートが信頼性の高い分析を行います。需要予測、価格戦略、政策評価、機械学習に基づいた倒産や不正会計予測、マーケットデザイン、ナウキャスティング、独占禁止法等の法規制、計量・行動マーケティングなど幅広い分野で研究成果を活用したコンサルティングサービスを提供しております。,https://utecon.net/,欧米では政策実施に際してEBPM(証拠に基づく政策決定)が重視されており、日本においても中央官庁で積極的に取り入れられております。また、米中IT大手を中心に民間企業においても経済学者を雇用し重要な意思決定において経済学の知見を活用する動きが本格化しております。我が国においても競争力強化のために経済学を始めとするアカデミックな知見の活用は本格化していくものと考えております。,経済学の領域において、幅広く国際的にも競争力のある研究者および分析陣を抱えております。既存の論文の実装にとどまらない、新たなアルゴリズムの開発を含む高度な分析・コンサルティングが可能です。,,,,,,,,,,,,,,,,,,,,,国立大学法人東京大学,2024年度
株式会社メドミライ,"MED MIRAI, Inc.",8010001218153.0,小野寺達也,https://medmirai.co.jp/,2021.0,5.0,2021年5月,,,,,,,3.0,医療機器,,1.0,最終財（企業向け製品）,0,0,0,0,1,0,,,,,,,,,,,,,,,,,,岸暁子　特任講師,"遠隔特定保健指導サービス（実施中）
医療機器プログラム（開発中）
",,,,,,,,,,,,,,,,,,,,,,,,,,,,,東京大学協創プラットフォーム開発,2023年度
ｉＰＥＡＣＥ２２３株式会社,iPEACE223 Inc.,8010001237426.0,樋口量一,https://ipeace223.com/,2023.0,8.0,2023年8月,,4.0,,,,,6.0,環境・エネルギー,,1.0,最終財（企業向け製品）,,,,,,,,,,,1.0,製品・サービス提供開始前（PoC前）,2025.0,2028.0,2029.0,2029.0,,,https://researchmap.jp/read0108487,,,,,横井俊之准教授,開発中,2028.0,1.0,2028年1月,1200000000,"バイオエタノールを原料として脱水したエチレンから、ゼオライト触媒を活用してプロピレンと、その誘導品をサスティナブルに製造し、カーボンニュートラルの実現を目指すベンチャーです。
触媒技術および、その触媒に合わせたプラントを設計することにより、化学品や燃料として需要の高いバイオプロピレンの製造技術を確立し、化石資源を使わない世の中へ貢献します。",https://ipeace223.com/,我々は、グリーンプロピレンを製造する設備（システム）を素材化学メーカーへ販売し、グリーンLPG（燃料や冷媒）およびグリーンな化学品原料を提供します。特にグリーンLPGは日本政府として2050年には完全にグリーン化することを決定しており、2030年頃から切り替わると想定されるLPG市場への参入を目指しています。,我々はこれまで培った触媒合成技術を基に、プラントの小規模化および製品の高収率化を進め、低コストなグリーンプロピレンの提供を強みとしています。特にエチレンからプロピレンを製造する他社技術と比較して、ゼオライト触媒による収率の高さは特徴的であり、POC実証していくことが現在の目標であります。,,,,,,,,,,,,,,,,,,,,,経営株主,2023年度
ワンドット株式会社,ONEDOTINC,8010401128737.0,鳥巣知得,https://onedot-inc.com/,2016.0,12.0,2016年12月," 50,000,000 ",11.0," 185,000,000 ", 0 ,,,10.0,その他 具体的に,小売　広告代理　コンサルティング,4.0,サービス/コンサルティング（受託研究開発を含む）,,,,,0,0,,,,,3.0,製品・サービス提供開始後（単年度赤字）,,,,,1.0,新規株式公開したい（IPO）,,,,,,,広告代理、デジタルマーケティング支援、越境販売あっせん、海外でのペット用品小売,2016.0,12.0,2016年12月,5000000,,,,,12.3,0.0,3.2,6.25,9.65,13.2,0.0,55.4,0.0,0.0,0.0,0.0,0.0,0.0,0.0,0.0,0.0,0.0,0.0,,オープンイノベーション推進１号投資,2023年度
株式会社ＤｅｓｉｇｎＢｉｒｔｈ,"DesignBirth Co.,Ltd.",8010601064625.0,大濱慎恭,https://www.designbirth.com/,2024.0,2.0,2024年2月," 100,000 ",1.0,"164,000 ","164,000 ",,,9.0,ソフトウェア・アプリ,,1.0,最終財（企業向け製品）,0,0,0,0,0,0,,,,,1.0,製品・サービス提供開始前（PoC前）,,,,,1.0,新規株式公開したい（IPO）,,,,,,,開発中,,,,,,,,,100.0,0.0,0.0,0.0,0.0,0.0,0.0,0.0,0.0,0.0,0.0,0.0,0.0,0.0,0.0,0.0,0.0,0.0,0.0,,大濱慎恭,2024年度
Ｍｏｒｕｓ株式会社,Morus Inc.,8011001139793.0,佐藤亮,https://morus.jp/jp,2021.0,4.0,2021年4月,,,,,,,2.0,バイオ・ヘルスケア,,1.0,最終財（企業向け製品）,,,,,,,,,,,,,,,,,,,,,,,,,,,,,,,,,,,,,,,,,,,,,,,,,,,,,,ANRI,2022年度
ハツムーブ,,8011101096860.0,林志鵬,,2021.0,11.0,2021年11月," 12,700,000 ",5.0,,,,,4.0,ロボティクス,,,,,,,,,,,,,,3.0,製品・サービス提供開始後（単年度赤字）,2022.0,2023.0,2026.0,2028.0,3.0,IPOやM&Aではなく、売上規模や従業員数の拡大を目指したい,https://researchmap.jp/komayang,,,,,陽品駒・次席研究員,,2022.0,1.0,2022年1月,1000000,"①ロボットレンタルサービスの実績
②弊社ロボットハンドの紹介
③弊社開発のロボットソフトウェアの紹介",,弊社はアニメキャラクターを基にした人型ロボットを開発し、親しみやすいデザインと表情で不気味の谷を回避。LLMのAI技術により円滑な対話を実現します。日本アニメは国内外で人気が高く、Anime Expoやコミケなどで訪日外国人からも支持されています。弊社は日本の技術とIPを活用し「2次元と現実の壁を超えるエンタメ」を目指します。世界初キャラクターロボットアイドルを発信し、次元を超える新エンタメを創造,"弊社の人型ロボットハンドの特徴
①高度なAI技術：LLMを活用し、円滑なコミュニケーションを実現。
②2次元キャラクターデザイン：親しみやすく魅力的なデザインで、アニメファン以外にも支持される仕様。
③モジュール化設計：ユーザーがシーンやニーズに合わせて容易に外装を変更できる
④高性能ロボットハンド：5自由度、適応的なつかみなど、人間の手に近い機能を提供。
",55.12,0.0,44.88,0.0,0.0,0.0,0.0,0.0,0.0,0.0,0.0,0.0,0.0,0.0,0.0,0.0,0.0,0.0,0.0,,陽品駒,2024年度
日本バイオリファイナリー株式会社,Japan Biorefinery Co.， Ltd.,8011301024803.0,椎葉 卓,https://japan-biorefinery.co.jp/,2019.0,2.0,2019年2月," 1,300,000 ",3.0,0 ,0 ,,,2.0,バイオ・ヘルスケア,,4.0,サービス/コンサルティング（受託研究開発を含む）,1,0,1,0,1,1,特許第6196761,9/19/2012,油汚染土を浄化する方法,椎葉究他,3.0,製品・サービス提供開始後（単年度赤字）,2019.0,2020.0,2021.0,2022.0,1.0,新規株式公開したい（IPO）,https://sites.google.com/view/dendai-syokuhinbio/page,,,,,椎葉究,竹からのヘルスケア製品の製造販売サービスのコンサルティング,,,,,当社が所有する知的財産である「竹バイオマスを原料としたヘルスケア製品の製造・技術エンジニアリング・商品説明などのコンサルティング,https;//japan-biorefinery.co.jp,,,,,,,,,,,,,,,,,,,,,,,東京電機大学,2020年度
株式会社Ｓｈｉｎｏｎｏｍｅ,"Shinonome, Inc.",8012301010685.0,種市隼兵,https://shinonome.com,2016.0,8.0,2016年8月," 41,200,000 ",10.0,,,,,9.0,ソフトウェア・アプリ,,4.0,サービス/コンサルティング（受託研究開発を含む）,,,,,,,,,,,4.0,製品・サービス提供開始後（単年度黒字かつ累積赤字）,,,,,1.0,新規株式公開したい（IPO）,,,,,,,PlayGroundという、アカデミック領域ではまかなう事が出来ない実践的なIT教育が無料で受けられるコミュニティを、全国の大学に設置しています。学生はオンライン、オフライン両方で参加することができ、このコミュニティで成長した学生は、クライアントとの研究開発や、サービス開発にアサインされます。行政機関からみると地方創生、企業からみると、開発・広報・採用、学生からみると無料で無限に学ぶことができる場所として、三方良しを提供しています。,2016.0,8.0,2016年8月,0,株式会社Shinonomeでは、ハイクラスの学生を育成する教育機関としての一面と、研究開発やサービス開発を行うクリエイティブスタジオの一面があります。優秀人材を育成したい大学関係者様や、仕事の依頼、採用などをしたい企業様のご連絡をお待ちしております。,https://shinonome.com,私達は、全国の若者から、お金や住んでいる場所のせいで叶えられないような、「環境のせいで選べなかった後悔をなくす」ことをミッションに活動しております。高校生が良い大学に入るのに塾に通うのが当たり前になったのと同じように、大学生がいい将来を歩むために通える場所というデファクトスタンダードを作ります。そして、その学生たちが有機的な活動をお金でないお金で取引し合う、巨大な経済圏を創出し、社会進出をした後もネットワークが継続するプラットフォームを作り、日本の技術力を底上げするのが我々の目的です。,,,,,,,,,,,,,,,,,,,,,,東京理科大学インベストメントマネジメント,2022年度
株式会社エピグノ,,8020001117775.0,乾　文良,https://epigno.jp/,2016.0,9.0,2016年9月," 100,000,000 ",17.0,,,,,9.0,ソフトウェア・アプリ,,1.0,最終財（企業向け製品）,,,,,,,,,,,3.0,製品・サービス提供開始後（単年度赤字）,2019.0,2020.0,2025.0,2027.0,,,,,,,,志賀卓弥,"医療・介護機関向けヒューマンリソースマネジメントシステム
エピタルHR",2020.0,,2020年,,国内初の医療・介護人材のヒューマンリソースマネジメントシステムです。複雑な医療・介護者のシフト作成から、人材不足を解決する定着支援まで、トータルでマネジメントいたします。,https://epigno.jp/,"医療介護人材市場は、今後人材不足が見込まれています。
公平なシフトや、評価、労働環境を整えることで、各施設で人材の定着を図ることができます。その結果、組織の採用競争力を上げていくことができ、好循環を産むことが可能です。","医療・介護人材向けタレントマネジメントシステムとして、ファーストムーバーとなります。
医療者が社内にいることで、ユーザーのペインを理解した開発と、ユーザーに寄り添った導入支援を実施することが可能になっています。
開発を加速させ、2028年までに医療機関向けシフト作成システムとして12％のシェアを目指します。
",,,,,,,,,,,,,,,,,,,,,エムスリー株式会社,2024年度
ゼネラルシムスサービス株式会社,GENERAL SIMS SERVICE INC.,8020001148424.0,井上 信孝,https://www.g-sims-s.co.jp,2022.0,10.0,2022年10月," 13,000,000 ",,"180,000,000 ",,,,10.0,その他,1と8に該当します,1.0,最終財（企業向け製品）,0,0,0,0,0,0,,,,,2.0,製品・サービス提供開始前（PoC後）,,,,,1.0,新規株式公開したい（IPO）,,,,,,坂本直哉准教授,開発中,,,,,,,,,100.0,0.0,0.0,0.0,0.0,0.0,0.0,0.0,0.0,0.0,0.0,0.0,0.0,0.0,0.0,0.0,0.0,0.0,0.0,,現在検討中,2024年度
（株）ワイズアンドテクノロジー,Wise AND Technorojy,8050001016306.0,鈴木伸治,http://www.wizz-tech.co.jp,2000.0,6.0,2000年6月," 40,000,000 ",17.0,"350,000,000 ","100,000,000 ",,,9.0,ソフトウェア・アプリ,,1.0,最終財（企業向け製品）,0,0,0,0,0,0,,,,,5.0,製品・サービス提供開始後（単年度黒字かつ累積赤字解消）,,,,,1.0,新規株式公開したい（IPO）,,,,,,,AI人員割当システム,2023.0,10.0,2023年10月,30000,,,,,62.5,12.5,6.25,0.0,0.0,0.0,0.0,0.0,19.0,0.0,0.0,0.0,0.0,0.0,0.0,0.0,0.0,0.0,0.0,0,筑波SBI,2024年度
株式会社Ｗｏｒｌｄ Ｌｉｆｅ Ｍａｐｐｉｎｇ,World Life Mapping,8050001046286.0,下田 彬,https://www.worldlifemapping.com,2019.0,7.0,2019年7月,,,,,,,7.0,AI・IoT,,1.0,最終財（企業向け製品）,,,,,,,,,,,1.0,製品・サービス提供開始前（PoC前）,,,,,,,,,,,,,「孤独に悩む人を0にする」をテーマに、人の脳のニューラルネットワークの構成にどのように影響を与えていくかという視点を持ちつつ、論文などの学術的な内容、同様の悩みを乗り越えた人の考え方など、多角的なデータから判断し、人の未来が最も良くなるような解決解消方法を提供していくシステム、サービスを開発提供していきます。,,,,,「孤独に悩む人を0にする」をテーマに、人の脳のニューラルネットワークの構成にどのように影響を与えていくかという視点を持ちつつ、論文などの学術的な内容、同様の悩みを乗り越えた人の考え方など、多角的なデータから判断し、人の未来が最も良くなるような解決解消方法を提供していくシステム、サービスを開発提供していきます。,https://www.worldlifemapping.com,,,87.0,,,,13.0,,,,,,,,,,,,,,,,CYBERDYNE株式会社,2020年度
Ｓｉｎｕｍｙ株式会社,PaylessGate Corporation,8120001214100.0,足立安比古,https://corp.sinumy.com/,2018.0,6.0,2018年6月," 405,000,000 ",,,,,,7.0,AI・IoT,,,,7,6,,,,,2020/080314,2018/10/15,"POSITION IDENTIFYING SYSTEM, POSITION IDENTIFYING DEVICE, POSITION IDENTIFYING METHOD, POSITION IDENTIFYING PROGRAM, COMPUTER READABLE RECORDING MEDIUM, AND RECORDED EQUIPMENT",足立安比古,,,,,,,1.0,新規株式公開したい（IPO）,https://researchmap.jp/lino,,,,,教授,,,,,,,,,,,,,,,,,,,,,,,,,,,,,,株式会社東京大学エッジキャピタルパートナーズ,2023年度
リバスキュラーバイオ株式会社,"Revascular Bio Co.,Ltd.",8120001248965.0,大森一生,https://revascularbio.com/,2022.0,9.0,2022年9月," 5,000,000 ",,,,,,,,,,,,,,,,,,,,,,,,,,,,,https://researchmap.jp/nt-MDandPhD,,,,,高倉伸幸・教授,,,,,,,,,,,,,,,,,,,,,,,,,,,,,,ouvc,2023年度
株式会社マイオリッジ,Myoridge Co. Ltd.,8130001058117.0,牧田 直大,https://myoridge.co.jp,2016.0,8.0,2016年8月,,16.0,,,,,2.0,バイオ・ヘルスケア,,1.0,最終財（企業向け製品）,,,,,,,,,,,,,,,,,,,,,,,,,心筋細胞分化誘導時にサイトカイン、成長因子、動物血清成分等のタンパク質を使わないケミカルディファインド培養であるため、安定した細胞生産が可能になっており、比較的高い心筋純度（>90%）が得られています。細胞の電気的性質に重要なHERGやKCNQ1、Kir2.1といった各種イオンチャネルの発現量が安定して高くなっており、実際の心臓における発現レベルに近くなっております。筋繊維が発達した明瞭なサルコメア構造が確認されております。心筋細胞の内9割が心室筋細胞であることを確認しております。,,,,,成熟した心筋細胞を作製することに成功しており、独自の三次元大量培養技術により性質の安定した高純度の心筋細胞を生産することが可能です。,https://myoridge.co.jp,現在、安全性評価や薬効スクリーニング等の創薬分野、心筋移植治療のような再生医療分野においてiPS細胞由来心筋細胞の需要が高まっている。本分野において実用化研究を行っている製薬企業や大学等の研究機関へ研究試料としてiPS細胞由来心筋細胞を提供する。市場はまだ発展途上ではあるものの日米欧で広がっており、中国での関心も少しづつ高まってきている。,弊社の心筋細胞は成熟心筋特有の薬剤応答性を示します。従来は検出が難しかった薬剤応答を検出することができる系となっております。,,,,,,,,,,,,,,,,,,,,Beyond Next Ventures,,2021年度
株式会社ＨｏｔＪｅｔ,"HotJet Co.,Ltd.",8130001061475.0,上辻靖夫,https://hot-jet.com/,2018.0,2.0,2018年2月," 5,100,000 ",4.0,,,,,6.0,環境・エネルギー,,1.0,最終財（企業向け製品）,1,0,0,0,0,3,7133851,2019/6/17,噴射ノズル及び気液混合流体生成方法,安田享,3.0,製品・サービス提供開始後（単年度赤字）,2018.0,2019.0,2024.0,0.0,2.0,IPOではなく、自社又は事業の一部を他企業等に売却したい（M＆A）,,,,,,,亜臨界水洗浄機械「HOTJET」,2019.0,5.0,2019年5月,1200000,水と空気のエネルギーを制御したの亜臨界水洗浄機械です。従来密閉空間でしか行われていなかった亜臨界状態の水を外部噴射することで、限られた空間内において化学洗剤や溶剤を使用せずに有機物の洗浄と抽出を可能にしています。また、一部において、塗膜剥離にも活用されています。,https://hot-jet.com/,既存の温水洗浄機、スチーム洗浄機では汚れが落ちない頑固な汚れを、人体に危険で、環境にも負荷を与える溶剤・化学剤等を使用しないで洗浄したいと考える事業者がターゲットであり、現在、商談へと推移しつつあります。,,0.0,75.0,23.0,0.0,0.0,0.0,0.0,0.0,0.0,0.0,2.0,0.0,0.0,0.0,0.0,0.0,0.0,0.0,0.0,顧問、取引先,なし,2023年度
有限会社　建築史塾Ａｒｃｈｉｓｔ,Archist Co.Ltd,8290002037962.0,山野善郎,,2004.0,4.0,2004年4月," 5,000,000 ",2.0,,,,,10.0,その他,歴史的建造物の調査研究および保存活用の支援,4.0,サービス/コンサルティング（受託研究開発を含む）,0,0,0,0,0,0,,,,,,,,,,,,,,,,,,山野善郎,図書制作・出版・販売,,,,,,,,,90.0,10.0,0.0,0.0,0.0,0.0,0.0,0.0,0.0,0.0,0.0,0.0,0.0,0.0,0.0,0.0,0.0,0.0,0.0,,山野善郎,2024年度
株式会社ジェクタス・イノベーターズ,Jectas Innovators company limited,8360001015169.0,新川武,https://jectasinnovators.com/,2011.0,11.0,2011年11月,,,,,,,10.0,その他,感染症ワクチン,4.0,サービス/コンサルティング（受託研究開発を含む）,3,0,,,0,0,,,,,1.0,製品・サービス提供開始前（PoC前）,,,,,2.0,IPOではなく、自社又は事業の一部を他企業等に売却したい（M＆A）,,,,,,新川武,なし,,,,,,,,,,,,,,,,,,,,,,,,,,,,,沖縄県,2024年度
株式会社モーションラボ,MotionLabo Inc.,8380001014904.0,清水信行,https/motionlabo.com,2007.0,4.0,2007年4月," 3,000,000 ",,,,,,9.0,ソフトウェア・アプリ,,4.0,サービス/コンサルティング（受託研究開発を含む）,,,,,,,,,,,,,,,,,2.0,IPOではなく、自社又は事業の一部を他企業等に売却したい（M＆A）,,,,,,,運動・振動・制御およびマルチボディダイナミクスに関連する技術支援(解析業務および講習会を通しての教育)の提供。特にダイナミクス教育、マルチボディ教育および最先端の柔軟体の理論の開発や解析のコンサルテーション、教育、研究指導を提供している。,,,,,"解析と計測サービスにより製品・業務に隠された問題を見つける。
ニーズに合わせたプログラム開発を行い、問題解決に導くプログラムを提案する。
専門技術者によるコンサルテーションサービスで技術的な課題を解決する。
CAE技術ぼ講習会の実施。",https://motionlabo.com,大企業は自前で解決できると思われるが、中・小企業で問題を抱えているところは多いと思われるが、弊社では宣伝が行き届かなく、現時点でニーズを持った会社へのアプローチに限界を感じている。,糸・紐・ロープなどのソフトマターの動的運動の問題の定式化や解析の技術は他社と比べて差別化できるかもしれない。,70.0,14.0,0.0,0.0,0.0,0.0,0.0,0.0,0.0,0.0,16.0,0.0,0.0,0.0,0.0,0.0,0.0,0.0,0.0,いわきリエゾンオフィス企業組合,なし,2023年度
つばめＢＨＢ株式会社,Tsubame BHB Co.	 Ltd,9010001182737.0,渡邊 昌宏,https://tsubame-bhb.co.jp,2017.0,4.0,2017年4月," 1,580,000 ",26.0,,,,,6.0,環境・エネルギー,,1.0,最終財（企業向け製品）,,,,,,,,,,,2.0,製品・サービス提供開始前（PoC後）,,,,,1.0,新規株式公開したい（IPO）,https://researchmap.jp/,https://researchmap.jp/,https://researchmap.jp/,https://researchmap.jp/,https://researchmap.jp/,細野秀雄　栄誉教授,オンサイトアンモニア製造システム,,,,,アンモニアは一極大量生産（20～100万トン）で生産され、船舶やトレーラーで輸送されている。これを顧客の元でアンモニア生産をできるようにしてコスト低減に貢献する。または、水素キャリアとして使用できるようにするシステムを提案する。,https://tsubame-bhb.co.jp/business-model/,国内では局地的に市場の倍以上の価格でアンモニアを購入しているユーザーがあり、そちらに当社システムの導入を検討。 海外では、120か国程度の非アンモニア生産国があり、そういった国・地域に当社システムを導入できると考えている。,東工大が開発した高活性の触媒を用い、アンモニア製造装置の小型化を達成。それらを用いて余った水素、熱、圧力、機器を用い安価にアンモニアを製造できる。,,,,,,,,,,,,,,,,,,,,,ユニバーサルマテリアルズインキュベーター,2019年度
株式会社ポーラスター・スペース,"Polar Star Space co., Ltd",9010001183132.0,中村 隆洋,http://polarstarspace.com/,2017.0,4.0,2017年4月," 19,000 ",6.0,"5,000,000 ",,,,8.0,航空宇宙,,1.0,最終財（企業向け製品）,,,,,2,,特許第6321895,3/22/2017,スペクトルカメラ制御装置、スペクトルカメラ制御プログラム、スペクトルカメラ制御システム、　このシステムを搭載した飛行体及びスペクトル画像撮像方法,高橋 幸弘、栗原 純一、石田 哲朗,,,,,,,1.0,新規株式公開したい（IPO）,,,https://researchmap.jp/read0138520,,,坂本 祐二,超高精度スペクトル計測機器,,,,,LCTFカメラ等高精度スペクトルカメラを搭載したドローン・超小型衛星飛翔体による、国内外対象となる計測ターゲット（特定農作物等）の病害の早期発見や防災、漁業、資源探索などへの課題解決に繋がる情報提供の可能性があり多分野への貢献が期待される。,http://polarstarspace.com/,当事業成果の適用領域は農業分野においては病害の特定に止まらす、施肥の最適化に繋がる農業生産性の向上、特定分野の状況や収穫時期の特定による農産品の付加価値化へ広がっていく可能性があり計測器や計測データユーザも農業従事者から農業ソリューション提供者まで幅広い波及が期待できる。,スペクトルカメラを搭載したドローンや超小型衛星飛翔体によるリモートセンシングサービスを可能にする直接の競合製品やサービスは現在のところ存在しない。従来航空機を活用して1日あたり６００万程度の費用が掛かることから需要の範囲が極めて限定的になっている。当社が独占使用権を有する北海道大学の国際特許（主要国で取得見込み）国内特許取得済（特許第6321895）によって当該特許に抵触する可能性はが高く一定の参入障壁の役割を果たしている。,53.3,,30.0,,16.7,,,,,,,,,,,,,,,,インキュベイトファンド,2018年度
